TranslatedRecipeName,Spice Tolerance,Dietary Preference
"Sweet Corn, Methi & Tomato Rice Recipe",Spicy,Vegetarian
Paneer Bread Balls Recipe -Cottage Cheese & Bread Croquettes,Spicy,Vegetarian
Sandah Guri Recipe (Assamese Roasted Rice Flour Porridge),Non-Spicy,Vegetarian
Bengali Sita Bhog Recipe,Spicy,Vegetarian
Warqi Paratha Recipe,Non-Spicy,Vegetarian
Spinach Mushroom Scrambled Eggs Recipe,Spicy,Non-Vegetarian
Ginger Lemon Black Tea Recipe,Non-Spicy,Vegetarian
Spicy Paneer Frankie Recipe,Spicy,Vegetarian
Rava Rotti Recipe (Karnataka Style Semolina Flat Bread),Spicy,Vegetarian
No Yeast Thin Crust Veggie Pizza Recipe,Spicy,Vegetarian
 Masoor Moong Phali Ki Dal Recipe,Spicy,Vegetarian
 Macaroni Chaat,Spicy,Vegetarian
Savoury Yogurt Parfait Recipe,Spicy,Vegetarian
Teriyaki Chicken Recipe,Spicy,Non-Vegetarian
Jimikand ke Kebab Recipe (Yam Kebabs),Spicy,Vegetarian
Karnataka Style Bendekayi Gojju - Kayirasa Recipe,Spicy,Vegetarian
Kodava Kootu Curry Recipe - Coorg Style Mixed Vegetable Stew,Spicy,Non-Vegetarian
Thenthuk Soup Recipe - Tibetan Style Noodle Soup,Spicy,Vegetarian
Broccoli Egg Scramble Recipe,Spicy,Non-Vegetarian
Lucknowi Murgh Biryani Recipe - Awadhi Style Chicken Biryani,Spicy,Non-Vegetarian
Chicken And Egg Slider Recipe With Cheesy Garlic Mayo,Spicy,Non-Vegetarian
Kela Methi Bhajiya Recipe,Spicy,Vegetarian
Fluffy Corn Muffins Recipe,Non-Spicy,Non-Vegetarian
Rajma Galouti Kebab Recipe,Spicy,Non-Vegetarian
Suran Moongphali Curry Recipe (Yam/Jimikand Curry with Peanuts),Spicy,Vegetarian
Calcutta Style Chicken Biryani Recipe,Spicy,Non-Vegetarian
Sprouted Methi & Kachha Aam Salad Recipe,Non-Spicy,Vegetarian
Assamese Boror Tenga Recipe (Vegetarian Sour Curry With Masoor Dal Fritters),Spicy,Vegetarian
Quick Prawn Tikka Masala Recipe,Spicy,Non-Vegetarian
Golden Turmeric Almond Saffron Milk Shot Recipe,Spicy,Vegetarian
Amritsari Dal Recipe,Spicy,Vegetarian
Khatti Meethi Tinda Masala Recipe,Spicy,Vegetarian
Mustard Prawns In Coconut Recipe,Spicy,Non-Vegetarian
Beetroot Greens Rice Recipe,Spicy,Vegetarian
Masoor Moong Phali Ki Dal Recipe (Masoor Dal With Peanuts Recipe),Spicy,Vegetarian
Quinoa Veg Soup (Bolivian Style Stew) Recipe,Spicy,Vegetarian
Mixed Vegetable Jalfrezi Recipe,Spicy,Vegetarian
Herbed Potato And Green Olive Salad Recipe - A Delicious Summertime Salad,Spicy,Vegetarian
Peanut Cucumber Salad Recipe,Spicy,Vegetarian
Tomato Upma Recipe,Spicy,Vegetarian
Eggless Pumpkin Cheesecake Recipe,Non-Spicy,Vegetarian
Chicken Galauti Kebab Recipe,Spicy,Non-Vegetarian
 Green Chutney Recipe,Spicy,Vegetarian
Andhra Style Karivepaku Pachadi Recipe (Curry Leaf Chutney Recipe),Spicy,Vegetarian
Aloo Konir Dom Recipe (Assamese Egg & Potato Curry),Spicy,Non-Vegetarian
 Sukhi Urad Dal Sabzi Recipe,Spicy,Vegetarian
Classic Apple Pie Recipe (Stars in the Galaxy),Spicy,Vegetarian
Raw Mango Cucumber Salad Recipe with Roasted Peanuts,Non-Spicy,Vegetarian
Creamed Spinach Recipe,Spicy,Vegetarian
8 Ingredient Sugar Free Granola Parfait Recipe,Non-Spicy,Vegetarian
 Parsi Style Lagan Sara Istew Recipe (Recipe In Hindi),Spicy,Vegetarian
Instant Carrot Pickle Recipe,Spicy,Vegetarian
Tangy Corn Tamatar Bharta Recipe,Spicy,Vegetarian
 Puli Keerai (Recipe In Hindi),Spicy,Vegetarian
 Palak Kadhi Recipe,Spicy,Vegetarian
Wheat Grass Rasam Recipe,Spicy,Vegetarian
Apple And Ginger Cocktail Recipe,Non-Spicy,Vegetarian
 Spicy Moong Dal Ki Goli Recipe,Spicy,Vegetarian
Matki Kala Chana Salad Recipe,Spicy,Vegetarian
Blueberry and Lemon Iced Tea Recipe,Spicy,Vegetarian
Thai Chicken Noodle Soup With Veggies Recipe,Spicy,Non-Vegetarian
Oriya Kakharu Phula Bhaja Recipe (Pumpkin Flower Fritters),Spicy,Vegetarian
Goan Mackerel Curry (Bangdyache Hooman) Recipe,Spicy,Non-Vegetarian
Delicious Dal Makhani Recipe Without Onion and Garlic (Jain),Spicy,Non-Vegetarian
 Dahi Suran Ki Kadhi Recipe,Spicy,Vegetarian
 Garlic Kheer (Recipe In Hindi),Non-Spicy,Vegetarian
No Bake Mango Yogurt Cheesecake Recipe With Raspberries,Spicy,Vegetarian
Atukula Ladoo Recipe - Sweetened Poha Energy Balls,Non-Spicy,Vegetarian
Apple Tea Latte Recipe,Non-Spicy,Vegetarian
Delicious One Pot Butter Chicken Khichdi Recipe,Spicy,Non-Vegetarian
"Raw Papaya, Apple & Carrot Salad Recipe",Spicy,Vegetarian
Khatti Meethi Ragi Masala Roti Recipe With Carrots,Spicy,Vegetarian
Nutty Chocolate High Fibre Biscuit Cake Recipe,Spicy,Vegetarian
Dahi Gujiya Recipe,Spicy,Vegetarian
Andhra Style Paruppu Podi Recipe - Dal Podi,Spicy,Vegetarian
No Onion No Garlic Rajasthani Gatte Ki Kadhi Recipe,Spicy,Vegetarian
Jhurre Jhule Aloo Bhaja Recipe,Spicy,Vegetarian
Thengai Poornam Kozhukattai & Uppu Kozhukattai Recipe,Spicy,Vegetarian
 Andhra Style Kandi Pachadi (Recipe In Hindi),Spicy,Vegetarian
Val Papdi Bhaji Recipe - Goan Style Flat Beans Dry Sabzi,Spicy,Vegetarian
 Knol Khol Flavored With Asafoetida (Recipe In Hindi),Spicy,Vegetarian
 Malvani Anda Curry Recipe,Spicy,Non-Vegetarian
Chargrilled Eggplant Tabbouleh Recipe,Spicy,Non-Vegetarian
Bengali Aloo Dum Recipe,Spicy,Vegetarian
Coriander Egg Curry Recipe,Spicy,Non-Vegetarian
Zucchini And Feta Cheese Bruschetta Recipe,Spicy,Vegetarian
Masala Chai Kulfi Recipe With Bourbon Chocolate Syrup,Spicy,Vegetarian
Hummus Flavoured With Garlic Recipe,Non-Spicy,Vegetarian
"Bengali Style Tomato Khejur Er Chaatni (Tomato, Cranberry and Dates Chutney )Recipe",Spicy,Vegetarian
Sindhi Style Doda Recipe (Spring Onion Rice Flour Flat Bread Recipe),Spicy,Vegetarian
Pineapple Kesari Bhath Recipe - Sweet Semolina Pudding,Spicy,Vegetarian
Masala Couscous Pulao Recipe,Spicy,Vegetarian
Karnataka Style Mixed Vegetable Pulao Recipe,Spicy,Vegetarian
 Baked Chinese Potato Recipe,Spicy,Vegetarian
Pan Roasted Zucchini & Mushroom Recipe,Spicy,Vegetarian
Kerala Style Chakkakuru Mezhukkupuratti Recipe-Jackfruit Seed Poriyal,Spicy,Vegetarian
Oats Apple Phirni Recipe,Non-Spicy,Vegetarian
Green Beans Poriyal Recipe With Peanuts & Sesame Recipe,Spicy,Vegetarian
Jaggery Coffee Without Milk Recipe,Spicy,Vegetarian
Grain Free Chocolate Porridge Recipe,Non-Spicy,Vegetarian
Corn Meal and Zucchini Muffin Recipe,Non-Spicy,Non-Vegetarian
Karwar Style Karatya Kismore Recipe - Sweet Tangy Bitter Gourd Sabzi,Spicy,Vegetarian
Fusion Spinach Parathas With Onion Tomato Salsa Recipe,Spicy,Vegetarian
 Cheesy Potatoes Recipe,Spicy,Vegetarian
Avarekalu Masala Vada Recipe,Spicy,Vegetarian
Healthy Oats Waffles Recipe,Spicy,Vegetarian
Onion Raita Recipe - Onion Raita Recipe,Spicy,Vegetarian
Capsicum Curry Recipe,Spicy,Vegetarian
Beetroot Carrot Tomato & Ginger Juice Recipe,Non-Spicy,Vegetarian
Burnt Garlic Chicken Fried Rice Recipe - Indo Chinese Fried Rice,Spicy,Non-Vegetarian
Onion Tomato Podi Masala Dosa Recipe,Spicy,Vegetarian
Falahari Rajgira Aloo Tikki Recipe (Gluten Free Amaranth Potato Patty),Spicy,Vegetarian
Kesar Elaichi Lassi Recipe,Non-Spicy,Vegetarian
 Paneer Makhani (Recipe In Hindi),Spicy,Vegetarian
Ras El Hanout Recipe (Moroccan Spice Powder),Spicy,Vegetarian
Vazha Thandu Poriyal Recipe - Tamil Nadu Style Dry Banana Stem Fry,Spicy,Vegetarian
Sutlac Recipe - Rose Infused Turkish Rice Pudding,Non-Spicy,Vegetarian
Coriander Tamarind Millet Rice Recipe,Spicy,Vegetarian
Potato Spinach Roulade Recipe With Parmesan Cheese & Herbed Butter Sauce,Spicy,Non-Vegetarian
Choco Berry Chia Parfait Recipe,Non-Spicy,Vegetarian
North Indian Style Green Raw Papaya Curry Recipe,Spicy,Vegetarian
Salt Bell Pudding Recipe - Kara BT Pudding,Spicy,Vegetarian
Cinnamon Spiced Black Lemon Tea Recipe,Spicy,Vegetarian
 Sindhi Karela Bhaji Recipe,Spicy,Vegetarian
Creamy Phirni Recipe - North Indian Rice Pudding,Non-Spicy,Vegetarian
Sprouted Moong And Methi Pulao Recipe,Spicy,Vegetarian
Moroccan Roast Chicken with Apricots Recipe,Spicy,Non-Vegetarian
Cheesy Kulcha Sandwich Recipe With Ghee Roast Mushrooms,Spicy,Vegetarian
Multigrain Paneer Dahi Vada Recipe,Spicy,Vegetarian
Savory Shrimps On Skillet Recipe,Spicy,Non-Vegetarian
Spiced Mulled Apple Juice Recipe,Spicy,Vegetarian
Herbed Cheesy Bun Recipe,Spicy,Vegetarian
Mexican Corn and Bell Pepper Tostadas Recipe,Spicy,Vegetarian
Mangalore Fish Curry Recipe,Spicy,Non-Vegetarian
Banana Date Chocolate Chip Cake Recipe,Non-Spicy,Non-Vegetarian
"Lettuce, Apple And Carrot Salad With Chilli Dressing Recipe ",Spicy,Vegetarian
Thai Style Vegetables & Raw Papaya Rice Recipe,Spicy,Vegetarian
Singhara Pulao Recipe - Water Chestnut Mixed Rice,Spicy,Vegetarian
Hyderabadi Shahi Mixed Vegetable Curry Recipe,Spicy,Vegetarian
Red Rice Dosa Recipe,Non-Spicy,Vegetarian
Chaal Kopi Recipe - Bengali Style Cauliflower Stir Fry,Spicy,Vegetarian
Mochiko Dango Recipe - Sweet Japanese Dumplings,Non-Spicy,Vegetarian
 Lehsuni Pudina Chutney Recipe,Spicy,Vegetarian
Baked Corn & Flour Tortilla Chips Flavored With Paprika Recipe,Spicy,Vegetarian
Jharkhand Dal Peethi Recipe,Spicy,Vegetarian
Mysore Bonda Recipe (Healthy Pan Fried Recipe),Spicy,Vegetarian
Khamang Kakdi Recipe - Khamang Kakdi Recipe,Spicy,Vegetarian
Apple Carrot Sweet Potato Soup With Garam Masala Roasted Chickpeas Recipe,Spicy,Vegetarian
Greek Style Kolokithokeftedes Recipe -Zucchini Fritters Recipe,Spicy,Vegetarian
Poppetjes Recipe - Sweet Puffy Wheat Dumpling Recipe,Spicy,Vegetarian
Masala Roti Recipe-Soft and Spicy Indian Flat Bread,Spicy,Vegetarian
Puli Keerai Recipe (Tamarind Spinach Curry),Spicy,Vegetarian
 Mutton Keema Soup Recipe,Spicy,Non-Vegetarian
"Tortilla Pizza With Tomato, Onion And Capsicum Recipe",Spicy,Vegetarian
Vegetarian Kabuli Pulao Recipe - Vegetarian Kabuli Pulao Recipe,Spicy,Vegetarian
Idli Upma Recipe - Idli Upma,Spicy,Vegetarian
Cabbage And Carrot Poriyal Recipe - No Onion And Garlic,Spicy,Vegetarian
 Sarson Ka Saag (Recipe In Hindi),Spicy,Vegetarian
Turkish Baklava Recipe From Scratch,Non-Spicy,Vegetarian
Spinach Foxtail Millet Dhokla Recipe,Spicy,Vegetarian
Maharastrian Bhadang Recipe (Puffed Rice Snack Mix),Spicy,Vegetarian
Double Beans Sundal Recipe,Spicy,Vegetarian
"Avocado, Grapefruit And Walnut Salad Recipe",Spicy,Vegetarian
Green Chilli Chicken Fry Recipe,Spicy,Non-Vegetarian
Methi Aur Kache Kele Ki Sabzi Recipe-Fenugreek Greens & Raw Banana Stir Fry,Spicy,Vegetarian
Apple Enchilada Recipe,Spicy,Vegetarian
Peanut Hummus Recipe,Spicy,Vegetarian
Ragi And Dill Nippattu Recipe,Spicy,Vegetarian
Karnataka Style Set Dosa Recipe,Non-Spicy,Vegetarian
Wheat Pudding Recipe - Gehun Ka Halwa (Recipe In Hindi),Spicy,Vegetarian
Indian Style Masala Omelette Grilled Sandwich Recipe,Spicy,Non-Vegetarian
Hara Chana Masala Recipe,Spicy,Vegetarian
Raw Papaya Thoran Recipe,Spicy,Vegetarian
Besan Laddu Recipe,Non-Spicy,Vegetarian
Mango Lemonade Recipe,Spicy,Vegetarian
Coconut Peanut Chutney Recipe - Coconut Peanut Chutney Recipe,Spicy,Vegetarian
Chinese Chicken Sweet Corn Soup Recipe,Spicy,Non-Vegetarian
"Pita Topped With Oven Roasted Cauliflower, Basil Avocado Sauce Recipe",Spicy,Vegetarian
Sour Sweet Radish Key Vegetable Recipe-Sweet And Tangy Radish Dry Recipe,Spicy,Vegetarian
Oats and Besan Cheela Recipe (High Protein Spiced Crepes),Spicy,Vegetarian
Ragi Oatmeal Kanji Recipe - Healthy Diabetic Porridge Recipe,Non-Spicy,Vegetarian
Black Rice Porridge Recipe,Non-Spicy,Vegetarian
Lemony Pasta Recipe With Roasted Shrimps,Spicy,Non-Vegetarian
Manipuri Style Chak Angouba Recipe - Vegetable Pulao Recipe,Spicy,Vegetarian
Malida Recipe (Healthy Whole Wheat Afghan Sweet),Spicy,Vegetarian
Quinoa Chocolate Cookies Recipe,Spicy,Non-Vegetarian
Muesli Olive Oil Rusk Recipe,Non-Spicy,Vegetarian
Malvani crispy lady finger recipe - groundnut lady finger vegetable,Spicy,Vegetarian
Healthy Ragi & Rice Breakfast Porridge Recipe,Non-Spicy,Vegetarian
Vegan Chickpeas And Broccoli Curry Recipe,Spicy,Vegetarian
Chettinad Nandu Varuval Recipe (Crab Fry Dry With Baby Onions),Spicy,Non-Vegetarian
Paneer Kofta Curry Recipe - Non Fried,Spicy,Vegetarian
Upvaas Thalipeeth Recipe,Spicy,Vegetarian
Whole Wheat Crepe With Eggs And Roasted Peppers Recipe,Spicy,Non-Vegetarian
Ginger Chutney Recipe - Ginger Chutney Recipe,Spicy,Vegetarian
Nagli/Ragi Laddu Recipe,Non-Spicy,Vegetarian
Tamil Nadu Style Vengaya Sambar Recipe - Pearl Onion Sambar,Spicy,Vegetarian
Flourless Chilli Chocolate Cake Recipe,Spicy,Non-Vegetarian
Lauki Badi Ki Sabzi Recipe,Spicy,Vegetarian
Radish Paratha (Radish Paratha) Recipe,Spicy,Vegetarian
Gujarati Batata Pulao Recipe - Sweet And Spicy Pulao With Lentils And Potatoes,Spicy,Vegetarian
Konkani Style Vali Bendi Recipe-Malabar Spinach Curry,Spicy,Vegetarian
Cucumber Gantha Recipe (Kheer Puli),Non-Spicy,Vegetarian
Dill Leaves Toor Dal Recipe - Shepu/ Suva Dal recipe,Spicy,Vegetarian
Karnataka Style Bell Saaru Recipe,Spicy,Vegetarian
One Pot Creamy Spinach Lentils Recipe,Spicy,Vegetarian
Jain Style Corn Palak - Jain Style Corn Palak (Recipe In Hindi),Spicy,Vegetarian
Chettinad Mushroom And Green Peas Stir Fry Recipe,Spicy,Vegetarian
Zhejiang  Style Crispy Five Spice Powder Spring Roll Recipe,Spicy,Vegetarian
Sauteed Spicy Prawns Recipe,Spicy,Non-Vegetarian
Sweet Potato And Carrot Sabzi Recipe,Spicy,Vegetarian
Vegetable Sandwich Recipe With Mashed Avocado And Cottage Cheese,Spicy,Vegetarian
Layered Thai Basil & Tofu Rice Recipe,Spicy,Vegetarian
Blueberry Muffin Cake Recipe,Non-Spicy,Non-Vegetarian
Quick Pulao With Onions And Tomatoes Recipe,Spicy,Vegetarian
Greek Style ??????????? Recipe (Black Eyed Beans with Celery and Thyme Recipe),Spicy,Vegetarian
Schezwan Chicken Sizzler Recipe,Spicy,Non-Vegetarian
Mixed Vegetable Corn Pakora Recipe - Made In Kuzhi Paniyaram Pan,Spicy,Vegetarian
 Spicy Gram Flour Sabzi (Recipe In Hindi),Spicy,Vegetarian
Mint Chutney Pasta Recipe - Pasta In Pudina Chutney Sauce Recipe,Spicy,Vegetarian
Healthy Lemon Cupcakes Recipe (Eggless),Non-Spicy,Vegetarian
Mogre's Sorbet Recipe - Fresh Jasmine Drink,Non-Spicy,Vegetarian
 Sukhi Suran Masala Sabzi Recipe,Spicy,Vegetarian
Bihari Dal Pitha Recipe (Traditional Bihari Delicacy),Spicy,Vegetarian
Ginger Teriyaki Rice Recipe,Spicy,Vegetarian
Urulai Kizhangu Roast Recipe - Spicy Potato Roast Recipe,Spicy,Vegetarian
South Indian Carrot Poriyal Recipe - Carrot Poriyal (Recipe),Spicy,Vegetarian
Cauliflower Moong Dal Recipe - Cauliflower Moong Dal Recipe,Spicy,Vegetarian
Health Benefits of Rasna (Alpinia Galanga) - Ayurvedic Medicinal Plant,Spicy,Vegetarian
Eggless Chocolate Pistachio Biscotti Recipe,Non-Spicy,Vegetarian
Dal Chingri (Bengali Style Channa Dal And Prawns) Recipe,Spicy,Non-Vegetarian
Schezwan Masala Dosa Recipe Using Classic Idli Dosa Batter,Spicy,Vegetarian
"Kidney Beans, Crumbled Feta, Basil Salad with Lemon Vinaigrette Recipe",Spicy,Non-Vegetarian
Maharashtrian Style Patichya Kandyachi Zunka Recipe -Spring Onions and Besan Sabzi,Spicy,Vegetarian
Mangalorean Style Ambe Upkari Recipe - Ripe Mango Curry,Spicy,Vegetarian
Vegetable Paella Recipe (Spanish Style Vegetable Rice),Spicy,Vegetarian
Spiced Rice Breakfast Porridge Recipe,Non-Spicy,Vegetarian
Butter Chicken Recipe - The Classic Indian Chicken Gravy,Spicy,Non-Vegetarian
Baingan Musallam Recipe (Mughlai Style Eggplant Simmered In Rich Tomato Curry),Spicy,Non-Vegetarian
Rajasthani Kachri Ki Chutney Recipe (Wild Cucumber Chutney),Spicy,Vegetarian
Mangalorean Style Kuvalyacho Pollav Recipe (Yellow Pumpkin Curry Recipe),Spicy,Vegetarian
Carrot Pistachio Coconut Cake Recipe,Non-Spicy,Non-Vegetarian
 Cabbage Tomato Sabzi (Recipe In Hindi),Spicy,Vegetarian
Vegan Black Beans Stuffed Paratha Recipe,Spicy,Vegetarian
Chicken Pad Thai Noodles Recipe,Spicy,Non-Vegetarian
Green Beans Lentil Usili Recipe - Iyengar Style,Spicy,Vegetarian
Artichoke Bodi Surri Recipe - Artichoke Fry,Spicy,Vegetarian
Spicy Schezwan Indo-Chinese Egg Fried Rice Recipe,Spicy,Non-Vegetarian
Dried Kala Chana Masala Recipe - Ashtami Prasad,Spicy,Vegetarian
Chana Methi Dal Recipe - Chana Methi Dal Recipe,Spicy,Vegetarian
Mexican Chicken Burger Recipe With Sour Cream & Salsa,Spicy,Non-Vegetarian
Pulao Recipe in Cataract Chail - Vegetable Reese Topped with Paneer Balas,Spicy,Vegetarian
Dal Ghiya with Punjabi Wadiyan Recipe - Lentils with Bottle Gourd & Sundried Lentil Dumplings,Spicy,Vegetarian
The recipe goes professionally,Spicy,Vegetarian
Ujju Rotti Recipe (Indian Rice Flat Bread),Non-Spicy,Vegetarian
Kala Chana Chaat Recipe-Chatpata Healthy Street food,Spicy,Vegetarian
Rajasthani Bajre Khatti Rabri Recipe,Non-Spicy,Vegetarian
Sri Lankan Egg Bread Recipe,Spicy,Non-Vegetarian
Pistachio & Cranberry Broken Wheat Pilaf Recipe,Spicy,Vegetarian
Old Fashioned Bread Pudding Recipe,Spicy,Non-Vegetarian
Khandeshi Dal Recipe,Spicy,Vegetarian
Baked Sweet Potato Boats Recipe,Spicy,Vegetarian
Pahari Style Phanu Recipe - Delicious Mixed Dal,Spicy,Vegetarian
Sour Sweet Pudla Recipe - Gujarati Steel Sweet & Savory Panke,Spicy,Vegetarian
Sweet & Spicy Soy Dipping Sauce Recipe,Spicy,Vegetarian
Tangy Raw Beetroot & Tomato Chutney Recipe,Spicy,Vegetarian
Cauliflower Tortilla Recipe,Spicy,Non-Vegetarian
Vegetarian Thai Massaman Curry Recipe,Spicy,Vegetarian
Maharashtrian Style Sheng Sola Recipe (Vegetable Stew),Non-Spicy,Vegetarian
Eggless Whole Wheat Cake with Chocolate Buttercream Frosting Recipe,Non-Spicy,Vegetarian
Yogurt Lamb Curry Recipe,Spicy,Non-Vegetarian
Thayir Semiya Recipe (Curd Semiya),Non-Spicy,Vegetarian
Karela Kadhi Recipe,Spicy,Vegetarian
Chicken Cooked in Banana Leaves Recipe,Spicy,Non-Vegetarian
Karathe Nonche Recipe - Bitter Gourd Pickle,Non-Spicy,Vegetarian
Spicy Chilli Mango Virgin Mojito Recipe,Spicy,Vegetarian
Kadai Mushroom Recipe,Spicy,Vegetarian
Grilled Cheese Chocolate Sandwich Recipe,Spicy,Vegetarian
Arbi Jhol Recipe -Uttar Pradesh Style Colocasia & Lotus Seeds Sabzi,Spicy,Vegetarian
Hirve Kalvan Recipe (Fresh Coriander and Coconut Curry),Spicy,Vegetarian
Grilled Vegetable Empanadas Recipe,Spicy,Non-Vegetarian
Karnataka Style Tamarind Gojju Recipe,Spicy,Vegetarian
Dhaba Style Spicy Ghee Rice Recipe Made From Whole Spices,Spicy,Vegetarian
Authentic Godumai Dosai Recipe - Whole Wheat Flour Crepes,Spicy,Vegetarian
Stuffed Dahi Vada Recipe,Spicy,Vegetarian
Dahi Wale Makhane Recipe - Lotus Seeds In Curd Gravy,Spicy,Vegetarian
Carrot Soup Recipe,Spicy,Vegetarian
Jolada Ganji Recipe (Jowar Savoury Porridge),Spicy,Vegetarian
Healthy & Delicious Jamun Fruit Smoothie - Black Plum Smoothie Recipe,Non-Spicy,Vegetarian
Khakra Chaat Recipe,Spicy,Vegetarian
Sweet Potato Avocado Brownie Bites Recipe,Non-Spicy,Non-Vegetarian
Menthya Jolada Mudde Recipe - Methi & Jowar Balls Recipe,Spicy,Vegetarian
Big Farm Fresh Pizza Recipe Loaded With Crisp Veggies,Spicy,Vegetarian
Fennel Pesto Pull-Apart Bread Recipe,Spicy,Vegetarian
Masala Omelette Sliders Recipe - High Protein Breakfast,Spicy,Non-Vegetarian
Paatolyo Recipe (Goan Sweet Dish),Non-Spicy,Vegetarian
Mexican Style Pumpkin and Spinach Quesadillas Recipe,Spicy,Vegetarian
Farm Fresh Vegetarian Pasta Salad Recipe,Spicy,Vegetarian
Struffoli Recipe,Non-Spicy,Vegetarian
Grilled Pesto Paneer Recipe,Spicy,Vegetarian
Beet Latte Recipe,Spicy,Vegetarian
Assamese Style Mohura Pitha Recipe - Sweet Rice Dumplings Recipe,Spicy,Vegetarian
Chocolate Buckwheat Pancake Skewers Recipe,Non-Spicy,Vegetarian
Andhra Style Peanut Chutney Recipe With Tomatoes,Spicy,Vegetarian
Drumstick Dal Recipe,Spicy,Vegetarian
Kabuli Chana Chaat - High Protein Snack of Chikki Chaat,Spicy,Vegetarian
Dhaba Style Tomato Chutney Recipe,Spicy,Vegetarian
Moong Dal Idli & Dosa Batter Recipe,Non-Spicy,Vegetarian
Stuffed Onion Vegetable Recipe,Spicy,Vegetarian
Grilled Eggplant Roll Recipe With Spicy Herbed Carrots,Spicy,Non-Vegetarian
"Dahi Chivda Recipe (Fruit, Yogurt & Flattened Rice Breakfast Parfait)",Non-Spicy,Vegetarian
Paan Matka Kulfi Recipe,Non-Spicy,Vegetarian
Classic Caesar Salad Recipe,Spicy,Non-Vegetarian
Summer Fruit Tart Recipe,Non-Spicy,Vegetarian
Ayam Goreng Kremes Recipe - Indonesian Style Crunchy Fried Chicken,Spicy,Non-Vegetarian
Mangalore Buns Recipe - Puffed Banana Puris,Non-Spicy,Vegetarian
Spinach And Millet Pulav Recipe,Spicy,Vegetarian
Mangalorean Style Lobia Gassi Recipe - Black Eyed Peas In Coconut Curry,Spicy,Vegetarian
"Roasted Vegetable Quesadilla Recipe With Zucchini, Carrots & Red Cabbage",Spicy,Vegetarian
Spinach Mushroom Chickpea Curry Recipe,Spicy,Vegetarian
Traditional Rasmalai Recipe,Non-Spicy,Vegetarian
Fusion Style Paneer Malai Makhani Recipe,Spicy,Vegetarian
Whole Wheat Flour Puttu Recipe,Spicy,Vegetarian
Zucchini Paratha Recipe,Spicy,Vegetarian
Indonesian Potato And Chicken Croquette Recipe,Spicy,Non-Vegetarian
Maavina Hannina Gojju (Karnataka Style Ripe Mango Curry Recipe),Spicy,Vegetarian
Chana Dal Aloo Cutlet Recipe - Gram Dal Potato Cutlet Recipe,Spicy,Vegetarian
Masala Vadai Kuzhambu Recipe (Mudaliar Style Curried Fritters In Spicy Tamarind Gravy),Spicy,Vegetarian
Mexican Corn Salsa Recipe,Spicy,Vegetarian
Mango And Yogurt Coconut Fool Recipe - Healthy Mango Yogurt Pudding,Non-Spicy,Vegetarian
Kerala Style Mutton Pepper Fry Recipe,Spicy,Non-Vegetarian
"Stuffed Pita Recipe With Tandoori Mayo Chickpeas, Pickled Onions and Vegetables",Spicy,Vegetarian
Cabbage Foogath Recipe - Goan Style Cabbage Stir Fry,Spicy,Vegetarian
Lehsun ki Chutney - Spicy Garlic Chutney,Spicy,Vegetarian
Caramelized Onion & Roasted Garlic Pasta Recipe,Spicy,Vegetarian
Raw Mango And Spring Onion Chutney Recipe,Spicy,Vegetarian
Bengali Style Chori Recipe-Mixed Vegetable Sabzi,Spicy,Non-Vegetarian
Pumpkin Vegetable Recipe with Panchh Phon Masala,Spicy,Vegetarian
Jaipuri Potato Onion Vegetable Recipe Using Preeti Electric Pressure Cooker,Spicy,Vegetarian
Til Ke Ladoo Recipe - Sesame Ladoo Recipe,Non-Spicy,Vegetarian
Hing Pani Puri Recipe-Asafoetida Pani Puri,Spicy,Vegetarian
Fajeto Recipe - Gujarati Ripe Mango Curry Recipe,Spicy,Vegetarian
Manda Pitha Recipe-Orissa Style Steamed Rice Flour Dumplings,Spicy,Vegetarian
Red Kidney Beans Tortilla Wraps Recipe,Spicy,Non-Vegetarian
Satvik Carrot Sprouts Salad Recipe - No Onion No Garlic,Spicy,Vegetarian
Rajma Aloo Cutlet Recipe (Tikki / Patty),Spicy,Non-Vegetarian
Savory Oatmeal Bowl with Saut�ed Carrot and Green Bean Recipe,Spicy,Vegetarian
So th injian badge repe onion badge ? la w badge badge ? potato badge,Spicy,Vegetarian
Vegetable Clear Soup Recipe,Spicy,Vegetarian
Goan Bimbla Uddamethi Recipe,Spicy,Vegetarian
Masalewari Chef Recipe (Spiced Sindhi Bread),Spicy,Vegetarian
Spicy Kiwifruit Salsa & Feta Toasties Recipe,Spicy,Vegetarian
Cheese and Spinach Tart Recipe,Spicy,Vegetarian
Recipe of Nut Mustard Chitran,Spicy,Vegetarian
Malvani Kala Chana Masala Recipe - Spicy Kala Chana Curry,Spicy,Vegetarian
Kakrar Jhal Recipe - Bengali Style Crab Curry,Spicy,Non-Vegetarian
Instant Lemon Avalakki Recipe - Instant Poha Snack,Spicy,Vegetarian
Kuvale Sasam Recipe - Konkani Ash Gourd Curry,Spicy,Vegetarian
Chicken Meatball Tacos Recipe,Spicy,Non-Vegetarian
Soya Keema Matar Masala Recipe,Spicy,Vegetarian
Baked Yogurt Tart Recipe with Figs and Blueberries Recipe(With Eggless Recipe Option),Non-Spicy,Non-Vegetarian
Spinach and Basil Pasta Sauce Recipe,Non-Spicy,Vegetarian
Bengali Style Kanch kolar Kofta Curry Recipe (Green Plantain Kofta Curry Recipe),Spicy,Vegetarian
Murgh Aloo Tikki Recipe - Chicken & Potato Tikki,Spicy,Non-Vegetarian
Sabudana Thalipeeth Recipe - Tapioca Pearl Spicy Flat Bread,Spicy,Vegetarian
Spiced Watermelon Curry Recipe With Carrots & Peppers,Spicy,Vegetarian
Vegetable Handi Biryani Recipe,Spicy,Vegetarian
Hari Dhania Ki Sabzi ( Fresh Coriander leaves Dry Curry) Recipe,Spicy,Vegetarian
Creamy Polenta With Mushrooms Recipe,Spicy,Vegetarian
Apple and Bok Choy Salad Recipe,Spicy,Vegetarian
Andhra Style Potato Korma Recipe,Spicy,Vegetarian
Broccoli And Tofu Green Curry Recipe,Spicy,Non-Vegetarian
Roasted Tomato And Basil Bruschetta Recipe,Spicy,Vegetarian
Nepalese Vegetable Pulao Recipe,Spicy,Vegetarian
Mutton Cut Recipe,Spicy,Non-Vegetarian
Kondakadalai Puli Vengaya Kuzhambu Recipe (South Indian Style Spicy And Tangy Kala Chana),Spicy,Vegetarian
Jowar Bajra Garlic Roti Recipe,Spicy,Vegetarian
Bitter Gourd Chips Recipe,Spicy,Vegetarian
South Indian Coconut Chutney Recipe With Coconut Water,Spicy,Vegetarian
Orange Cranberry Cupcakes Recipe,Non-Spicy,Non-Vegetarian
Fizzy Pomegranate Mint Mocktail Recipe,Non-Spicy,Vegetarian
Steamed Vegetables With Chilli Lime Butter Recipe,Spicy,Vegetarian
Balsamic Glazed Eggplant Feta Rollatini Recipe,Non-Spicy,Non-Vegetarian
Mughlai Dum Arbi Recipe,Spicy,Vegetarian
Chicken Bharta Recipe - Dhaba Style Chicken Masala,Spicy,Non-Vegetarian
Spaghetti Tomato Recipe (Pasta in Tomato Basil Sauce),Spicy,Vegetarian
Dal And Vegetable Kebab Recipe,Spicy,Vegetarian
Zucchini Wheat Semolina Salt Recipe,Spicy,Non-Vegetarian
Karnataka Style Avarekalu Kosambari Recipe,Spicy,Vegetarian
Chicken Pizza With Caramelised Red Onion Recipe,Spicy,Non-Vegetarian
Kung Pao Chicken With Vegetable Fried Rice Recipe,Spicy,Non-Vegetarian
Shahi Bhindi Recipe in Cashew Nut Gravy - Okras in Cashew Nut Curry,Spicy,Vegetarian
Kashmiri Style Nadru Yakhni Recipe-Lotus Stem in Yogurt Sauce,Non-Spicy,Vegetarian
Mughlai Bhindi Recipe - Spicy Okra Curry,Spicy,Vegetarian
Kesar Badam Cupcakes With Shrikhand Recipe,Non-Spicy,Vegetarian
Muttai Parotta Recipe ( Ande Ka Paratha / Egg Filled Flat Bread),Spicy,Non-Vegetarian
Asian Shrimp Rice Burger Recipe,Spicy,Non-Vegetarian
Homemade Herb Butter Recipe,Non-Spicy,Vegetarian
Braised Pork Belly Recipe,Spicy,Non-Vegetarian
Maharashtrian Style Namkeen Shankarpali (Savory Flaky Pastry Diamonds Recipe),Spicy,Vegetarian
Semolina Gujiya Recipe,Non-Spicy,Vegetarian
Crispy and Spicy Chilli Chicken Recipe - Indian Style,Spicy,Non-Vegetarian
Lehsuni Methi Paneer Recipe - Garlic Methi Paneer Curry,Spicy,Vegetarian
Spinach Tomato Soup Italian Style Recipe,Spicy,Vegetarian
Chettinad Thakkali Vengaya Kuzhambu Recipe,Spicy,Vegetarian
Samai Arisi Pidi Kozhukattai (Tamil Nadu Breakfast Recipe),Spicy,Vegetarian
Mushroom Stroganoff Recipe,Spicy,Vegetarian
Delicious Skillet Roasted Fondant Potatoes Recipe,Spicy,Vegetarian
Parsi Mutton Cutlets Recipe,Spicy,Non-Vegetarian
Foxtail Millet Khichdi Recipe with Batata Aloo Nu Shaak,Spicy,Vegetarian
Konkani Tendli Sukke Recipe - Ivy Gourd/Tindora Stir Fry,Spicy,Vegetarian
Cheese And Corn Tostadas Recipe,Spicy,Vegetarian
