TranslatedRecipeName,Spice Tolerance,Dietary Preference
Sprouted Ragi & Rajma Cutlets Recipe,Spicy,Non-Vegetarian
Creamy Thai Sweet Potato Curry Recipe,Spicy,Vegetarian
Carrot Capsicum Poriyal Recipe,Spicy,Vegetarian
Paneer in White Gravy Recipe - No Onion No Garlic Recipe,Spicy,Vegetarian
Thor Chal Recipe - Banana Stem Pulao Recipe,Spicy,Vegetarian
Chicken Galouti Kebab Recipe,Spicy,Non-Vegetarian
Chatpata Aloo Chaat Taco Recipe With Sour Cream & Salad,Spicy,Vegetarian
Eggless Sugarless Oats And Nuts Cookie Recipe,Spicy,Vegetarian
Badam Halwa Recipe - Delicious Almond Halwa With Khoya,Non-Spicy,Vegetarian
Stuffed Karela With Aloo Recipe,Spicy,Vegetarian
Indo Chinese Chicken Hakka Noodles Recipe,Spicy,Non-Vegetarian
Lau Chingri Recipe (Bottle Gourd And Shrimp Curry),Spicy,Non-Vegetarian
Raw Banana & Ajwain Paratha Recipe,Spicy,Vegetarian
Strawberry Coconut Trifle Pudding Recipe,Non-Spicy,Vegetarian
Spicy Soya Keema Masala Recipe,Spicy,Vegetarian
Greek Style Green Beans Stir Fry Recipe,Spicy,Vegetarian
Kothamalli Karuveppilai Sadam Recipe - Coriander And Curry Leaves Rice,Non-Spicy,Vegetarian
Methi Chaman Recipe -Paneer In Dark Leafy Greens Based Gravy,Spicy,Vegetarian
Quick Microwave Chocolate Pudding Recipe,Spicy,Vegetarian
Healthy Ragi Energy Balls with Strawberry Recipe,Non-Spicy,Vegetarian
Lemon Rosemary Sauce Baked Penne Pasta Recipe,Spicy,Vegetarian
No Churn Strawberry Ice Cream Recipe,Non-Spicy,Vegetarian
Spaghetti With Broccoli And Smoked Almonds Recipe,Spicy,Vegetarian
Pizza With Soy And Corn Recipe,Spicy,Vegetarian
Healthy Jamun Cooler Recipe (Black Plum Juice),Spicy,Vegetarian
Senai Kizhangu Gotsu Recipe - Spicy & Tangy Yam Curry Recipe,Spicy,Vegetarian
Classic Greek salad Recipe,Spicy,Vegetarian
Maharashtrian Misal Pav Recipe,Spicy,Vegetarian
Mughlai Fish Curry Recipe,Spicy,Non-Vegetarian
Karuveppilai Chutney Podi Recipe - Curry Leaves Chutney Podi,Spicy,Vegetarian
Refried Beans and Mushroom Tostada Recipe,Spicy,Non-Vegetarian
Cranberry Cookie Recipe,Spicy,Non-Vegetarian
Malabar Style Dates Coriander Chutney Recipe,Spicy,Vegetarian
Masaledar Moongphali Til Wale Aloo Recipe,Spicy,Vegetarian
Mangalorean Manoli Curry Recipe - Indian Gherkins Curry,Spicy,Vegetarian
Mysore Chutney Recipe - Chana Dal Chutney,Spicy,Vegetarian
Mangai Inji Pickle Recipe- Instant Mango Ginger Pickle,Spicy,Vegetarian
Bengali Style Mixed Vegetable Sweet Pilaf Recipe,Spicy,Vegetarian
Mulakushyam Recipe - A Mixed Vegetable Lentil Curry,Spicy,Vegetarian
"Sweet Potato, Celery & Peanut Soup Recipe",Spicy,Vegetarian
Caprese Empanada Recipe With Tomato Basil And Mozzarella,Spicy,Non-Vegetarian
Lapsi Recipe  - Sweetened Gujarati Broken Wheat,Spicy,Vegetarian
Asian Watermelon Salad Recipe,Spicy,Vegetarian
Karnataka Style Obbattu Saaru Recipe - Sweet & Spicy Rasam Recipe,Spicy,Vegetarian
Giant Chocolate Chunk Cookie Recipe with Walnuts,Non-Spicy,Non-Vegetarian
Mushrooms And Zucchini Puffs Recipe,Spicy,Non-Vegetarian
Sri Lankan Chilli Potatoes Recipe,Spicy,Vegetarian
Radhaballabhi Recipe (Bengali Stuffed Poori With Spiced Urad Dal),Spicy,Vegetarian
Spinach Ricotta Balls in Garlic Tomato Basil Sauce Recipe,Spicy,Vegetarian
Methi & Pudina Aloo Sabzi Recipe,Spicy,Vegetarian
Fruit Tart Recipe - Vegan,Non-Spicy,Vegetarian
Parsi Style Baingan Capsicum Ka Salan Recipe,Spicy,Non-Vegetarian
Savoury Crepes with Za'atar Spiced Chicken Recipe,Spicy,Non-Vegetarian
Recheado Chicken Naan Wraps Recipe,Spicy,Non-Vegetarian
Vegetable Tortilla Pizza Recipe,Spicy,Vegetarian
Roasted Onion Gosht Recipe - Mutton Curry with Roasted Onion & Spices,Spicy,Non-Vegetarian
Dherosh Chingri Jhol Recipe (Bengali Style Prawn Curry With Ladies Finger),Spicy,Non-Vegetarian
Aloo Bread Pakora Recipe,Spicy,Vegetarian
Spicy Mushroom Puffs Recipe (Empanadas stuffed with Mushroom Recipe),Spicy,Non-Vegetarian
Instant Chilli Pickle Recipe,Spicy,Vegetarian
Bhakri Chaat Recipe With Green Moong Sprouts And Aloo,Spicy,Vegetarian
Rawalpindi Style Chole Recipe,Spicy,Vegetarian
Achari Pumpkin Vegetable Recipe,Spicy,Vegetarian
Veg Makhanwala Recipe - North Indian Mixed Vegetables Gravy,Spicy,Vegetarian
How to make Egg Free Mayonnaise Recipe,Spicy,Vegetarian
Sindhi Style Besan Tikki Ki Sabzi Recipe,Spicy,Vegetarian
"Turmeric, Ginger And Chilli Pickle Recipe",Spicy,Vegetarian
Spicy Matar Masala Recipe,Spicy,Vegetarian
Andhra Style Davva Aava koora Recipe (Sweet and Spicy Banana Stem Peanut Curry Recipe),Spicy,Vegetarian
"Broccoli, Carrot And Capsicum Sabzi Recipe",Spicy,Vegetarian
"Mushroom, Spinach & Herbs Frittata with Egg White Recipe",Spicy,Non-Vegetarian
Spinach Hummus Recipe,Non-Spicy,Vegetarian
Pinto Bean Salsa Salad Recipe,Spicy,Vegetarian
Chicken Momos Recipe -Delicious Steamed Chicken Dumplings,Spicy,Non-Vegetarian
Broccoli Egg Bhurji Recipe,Spicy,Non-Vegetarian
Avocado And Almond Salad Recipe With Feta Cheese,Spicy,Vegetarian
Masala Akki Roti With Spinach Recipe - sarvapindi,Spicy,Vegetarian
Spinach Khandvi Recipe - Savory Gram Flour Pinwheels With Spinach,Spicy,Vegetarian
Spiked Onion Casserole Recipe - Onion Casserole Recipe,Spicy,Vegetarian
Kashmiri Methi T Golemach Recipe-Minced Chicken Balls With Fenugreek Leaves,Spicy,Non-Vegetarian
Carrot Cake Pancakes Recipe,Spicy,Non-Vegetarian
Oats Cheela Recipe Stuffed With Creamy Palak Paneer,Spicy,Non-Vegetarian
Eggless Lemon Pound Cake Recipe,Non-Spicy,Vegetarian
Vegan Mango Lassi Recipe,Non-Spicy,Vegetarian
Puli Inji Recipe - Tamarind and Ginger Chutney,Spicy,Vegetarian
Tandoori Mayonnaise Chicken Cigar Recipe,Spicy,Non-Vegetarian
Russian Radish Cucumber Salad Recipe,Non-Spicy,Non-Vegetarian
Egg Pakora Recipe - Egg Fritters,Spicy,Non-Vegetarian
Soya Keema Aloo Paratha Recipe,Spicy,Vegetarian
Curd Rice With Carrots Recipe,Spicy,Vegetarian
No-Bake Strawberry Cream Cheese Dessert Recipe,Non-Spicy,Vegetarian
Eggless Mango Muffins Recipe,Non-Spicy,Non-Vegetarian
Hyderabadi Khatti Dal Recipe (Hyderabadi Tangy Lentil Curry),Spicy,Vegetarian
North Arcot Special Thavalai Dosai Recipe,Spicy,Vegetarian
Oats Sugar Pongal Recipe,Non-Spicy,Vegetarian
Chatpata Lobia Chaat Recipe - Healthy Black Eyed Bean Snack,Spicy,Vegetarian
Indori Poha Recipe,Spicy,Vegetarian
Chocolate Chip Cookies With Coconut Recipe,Spicy,Non-Vegetarian
Singhara Ato Chill Recipe (No Onion No Garlic Navratri Fasting / Fasting Recipe),Spicy,Vegetarian
Spiced Ghee Rice Recipe | Neychoru,Spicy,Vegetarian
Maharashtrian Tandalachi Ukad Recipe - Rice Flour And Buttermilk Porridge,Spicy,Vegetarian
Parmesan Corn Chili Fries Recipe,Spicy,Vegetarian
Dal Fara Recipe (Indian Stuffed Lentil Dumplings),Spicy,Vegetarian
Chinese Fried Rice Recipe With Chicken And Shredded Lettuce,Spicy,Non-Vegetarian
Aval Payasam Recipe - Sweet Flattened Rice Payasam,Spicy,Vegetarian
Spicy Tomato Rice - Tomato Pulihora Recipe,Spicy,Vegetarian
Punjabi Style Egg Curry Recipe,Spicy,Non-Vegetarian
Bhopali Style Gosht Ka Pulao Recipe,Spicy,Non-Vegetarian
Bengali Holud Mishti Pulao Recipe - Saffron Flavored Rice With Nuts,Spicy,Vegetarian
Chotti Aloor Dum Recipe - Baby Potatoes In Tomato Gravy,Spicy,Vegetarian
Mango Rice Noodle Salad With Cucumber & Carrot Recipe,Spicy,Vegetarian
Mooli Bhurji recipe,Spicy,Vegetarian
Gilka Bhajji Recipe-Silk Squash Fritters,Spicy,Vegetarian
French Toast Recipe Flavored with Orange,Spicy,Non-Vegetarian
Bisi Bele Bath Recipe - A Spicy Mixed Vegetable Sambar Rice,Spicy,Vegetarian
Godhi Chutney Podi Recipe (Wheat Germ South Indian Spice Powder),Spicy,Vegetarian
Suji Manda Pitha/Sweetened Coconut Stuffed Semolina Dumplings Recipe,Spicy,Vegetarian
Spinach Enchilada Recipe,Spicy,Vegetarian
Healthy General Tso's Chicken Recipe,Spicy,Non-Vegetarian
Crostini With Peppers & Cheese Recipe,Spicy,Vegetarian
Karnataka Style Hurali Kalu Saaru Recipe,Non-Spicy,Vegetarian
Mushroom and Prawn Malai Curry Recipe,Spicy,Non-Vegetarian
Beerakaya Tomato Koora Recipe (Andhra Style Ridge Gourd Curry),Spicy,Vegetarian
Sholeh Zard Recipe -  Persian Saffron Rice Pudding,Spicy,Vegetarian
Tamarind Chilli Potato Recipe,Spicy,Vegetarian
Cheese and Bacon Pinwheels Recipe,Spicy,Non-Vegetarian
Roasted Tomato Basil Pasta & Pizza Sauce Recipe,Spicy,Vegetarian
Paal Payasam Recipe - Rice Kheer / Pudding,Spicy,Vegetarian
Spicy Indian Style Onion Rings Recipe,Spicy,Vegetarian
Penne Arrabbiata Pasta Recipe,Spicy,Vegetarian
Amritsari Gobi Matar Recipe (Punjabi Style Creamy Cauliflower and Peas Curry),Spicy,Vegetarian
Green Peas Sandwich Recipe,Spicy,Vegetarian
Congress Buns Recipe,Spicy,Vegetarian
Lemon 7 Up Cake Recipe,Non-Spicy,Non-Vegetarian
Methi Moong Dal Recipe - Healthy Diabetic Friendly Recipe,Spicy,Vegetarian
Sprouted Moong And Onion Pakora - Sprouted Moong and Onion Pakoras Recipe,Spicy,Vegetarian
Beetroot Juice Recipe With Cucumber & Pineapple,Non-Spicy,Vegetarian
Andhra Vankaya Fry Recipe With Peanuts - Brinjal Peanut Sabzi,Spicy,Vegetarian
One Pot Masala Vegetable Rice Recipe,Spicy,Vegetarian
Beans Vepudu Recipe (Andhra Style Beans Cooked With Spicy Sesame Spicy Mix),Spicy,Vegetarian
Lentil Spinach Recipe - Red Amarnath With Tour Dal,Spicy,Vegetarian
Rose Greek Yogurt Dessert Recipe With Pista & Coconut,Non-Spicy,Vegetarian
Chicken Tariwala Recipe - Punjabi Murgh Tariwala Recipe,Spicy,Non-Vegetarian
Hyderabadi Laziz Lamb Handi Recipe,Spicy,Non-Vegetarian
Raw Mango Puliyogare Gojju Recipe With Peanuts,Spicy,Vegetarian
Broccoli Chocolate Muffins Recipe,Non-Spicy,Non-Vegetarian
Stuffed Bharwa Tinda Recipe (Stuffed Apple Gourd),Spicy,Vegetarian
Tadkewali Masoor Dal Khichdi Recipe With Garlic & Onions,Spicy,Vegetarian
Maharashtrian Kulith Shengole Recipe - Spicy Horse Gram Flour Dumplings,Spicy,Vegetarian
Saffron Cream Milk Recipe,Spicy,Vegetarian
Lentil Bread Buttermilk Recipe (Lentil Piles in Yogurt Surri),Spicy,Vegetarian
Chocolate And Semolina Halwa Recipe,Spicy,Vegetarian
Eggless Whole Wheat Banana Bread Recipe-Vegan Options,Non-Spicy,Vegetarian
Pan Grilled Balsamic Chicken Breast And Mushrooms Recipe,Spicy,Non-Vegetarian
Himachal Pahari Style Teliah Mah Recipe (Brown Horse Gram Curry),Spicy,Vegetarian
Arbi Ajwain Ki Sabzi Recipe (Roasted Colocasia Stir Fry With Ajwain),Spicy,Vegetarian
Barnyard Millet Mushroom Biryani Recipe,Spicy,Vegetarian
High-Protein Peanut Chutney Recipe-Indian Style Peanut Chutney Without Coconut,Spicy,Vegetarian
Delicious Methi Chicken Curry - Murgh Methi Curry Recipe,Spicy,Non-Vegetarian
Mexican Fiesta Soup With Roasted Tomatillo Pesto Recipe,Spicy,Non-Vegetarian
North Indian Sooji Halwa Recipe,Spicy,Vegetarian
Mustard Green Chilli Pickle Recipe,Spicy,Vegetarian
Mint & Coriander Chilli Potato Salad Recipe - No Mayo Salad,Spicy,Vegetarian
Orange Peel Kuzhambu Recipe - Orange Peel Tamarind Based Curry,Spicy,Vegetarian
Aloo Took Recipe - Sindhi Style Double Baked Crispy Potatoes,Spicy,Vegetarian
Poliyodharai / Puliyogare Recipe (using Millets),Spicy,Vegetarian
Andhra Steel Kandi Attu Recipe (Tour Dal Dosa Recipe),Spicy,Vegetarian
Quinoa Chocolate Carrot Cake Recipe,Non-Spicy,Non-Vegetarian
Easy Homemade Sugar Free Dates Flavored Yogurt Recipe,Spicy,Vegetarian
Kancha Peper Kofta Curry Recipe-Bengali Green Papaya Kofta Sabzi,Spicy,Vegetarian
Crepes Stuffed with Nutella and Seasonal Fruits Recipe,Non-Spicy,Non-Vegetarian
Easy Homemade Queso Dip Recipe,Spicy,Vegetarian
Ragi & Oats Rava Idli Recipe-Finger Millet and Oats Idli,Spicy,Vegetarian
Scrambled Tofu Noodles Recipe,Spicy,Vegetarian
Avocado Mint Soup Recipe,Spicy,Vegetarian
Roasted Beet Salad Recipe With Pearl Barley & Spinach,Spicy,Vegetarian
Chinese Egg Drop Soup Recipe (With Vegetarian Option),Spicy,Non-Vegetarian
Braided Almond Roll Recipe,Non-Spicy,Vegetarian
Maharashtrian Masale Baath Recipe - Spicy Vegetable Rice with Goda Masala,Spicy,Vegetarian
Salted Caramel Sauce Recipe,Non-Spicy,Vegetarian
Karnataka Style Badanekai Yennegai Gojju Recipe (Stuffed Brinjal Recipe),Spicy,Non-Vegetarian
Murg Anardana Recipe - Pomegranate Chicken In Yogurt Gravy,Spicy,Non-Vegetarian
Bell Pepper & Cheese Macaroni Recipe,Spicy,Vegetarian
Udupi Style Sannappa Recipe (Brown Rice and Banana Fritters Recipe),Spicy,Vegetarian
Hariyali Tawa Fish Fry Recipe,Spicy,Non-Vegetarian
Tomato All Recipes,Spicy,Vegetarian
Iyengar Bakery Khara Biscuit Recipe,Spicy,Vegetarian
Fruit-Chia Rice paper rolls in a Mango Tahini Dipping sauce Recipe,Spicy,Vegetarian
Masoor Dal and Rajma Masala Recipe,Spicy,Non-Vegetarian
Watermelon Margarita Granita Recipe,Non-Spicy,Vegetarian
Thai Baked Chicken Satay Recipe With Thai Peanut Sauce,Spicy,Non-Vegetarian
Mutton KM Samos Recipe-Meat Singara,Spicy,Non-Vegetarian
Dhaba Style Green Moong Dal Tadka Recipe,Spicy,Vegetarian
Carrot And Orange Loaf Cake Recipe,Non-Spicy,Non-Vegetarian
Banana And Mango Smoothie Recipe,Non-Spicy,Vegetarian
Tandoori Paneer Samosa Recipe - With Baked Option,Spicy,Vegetarian
Goan Pumpkin Sabzi Recipe,Spicy,Vegetarian
Pumpkin Halwa (Kaddu Ka Halwa) Recipe,Non-Spicy,Vegetarian
Spicy Schezwan Vegetable Noodles Recipe,Spicy,Vegetarian
Maharashtrian Style Kakdichi Amti (Cucumber Gravy Recipe),Spicy,Vegetarian
No Onion And No Garlic Aloo Gajar Matar Ki Sabzi Recipe,Spicy,Vegetarian
Tomato Chickpea and Coconut Soup Recipe,Spicy,Vegetarian
Pakki Mutton Biryani Recipe,Spicy,Non-Vegetarian
Veg Chilli Milli Recipe,Spicy,Vegetarian
Kathal Biryani Recipe- Raw Jackfruit Biryani Topped with Caramelised Onions,Spicy,Vegetarian
Strawberry and Avocado Caprese Salad Recipe,Spicy,Vegetarian
Malai Chickpea Kebab Recipe,Spicy,Vegetarian
Aloo Poha Recipe - Potato Poha,Spicy,Vegetarian
Penne Pasta Recipe In Spinach Pesto Sauce,Spicy,Vegetarian
Instant Garlic Pickle Recipe,Spicy,Vegetarian
Bhoplyache Gharge Recipe (Maharashtrian Style Sweet Pumpkin Puris),Spicy,Vegetarian
Little Millet Pudding Recipe- Kootiki / Sama Pudding,Spicy,Vegetarian
Brown Rice & Quinoa Risotto Recipe,Spicy,Vegetarian
Sama Khichdi Recipe - Barnyard Millet Khichdi -Navratri Fasting - Vrat Recipe,Spicy,Vegetarian
Gulab Jamun Recipe With Khoya,Non-Spicy,Vegetarian
Bakery Style Baked Nippattu Recipe,Spicy,Vegetarian
Besan Bread Toast Recipe On Tawa - Vegetarian French Toast,Spicy,Vegetarian
Paneer Kulcha Recipe-Cottage Cheese Stuffed Leavened Flatbread,Spicy,Vegetarian
Red Poha And Flax Seeds Ladoo Recipe,Spicy,Vegetarian
Homemade Soft Idli Recipe - Steamed Rice and Lentil Cake,Non-Spicy,Vegetarian
Goan Style Baby / Baby / Baby Recipe,Spicy,Non-Vegetarian
Vegan Chocolate Fudgesicles Recipe,Non-Spicy,Vegetarian
Chicken Malai Kabab Recipe,Spicy,Non-Vegetarian
Bengali style meat broth recipe-mutton curry,Spicy,Non-Vegetarian
Badam Sharbat Recipe - Almond Milk With Nuts & Spices,Non-Spicy,Vegetarian
Spicy Rice Stuffed Paratha Recipe,Spicy,Vegetarian
Maharashtrian Style Dashmi Roti Recipe (Jaggery Flatbread),Spicy,Vegetarian
Stuffed Yellow Moong Dal And Onion Paratha Recipe,Spicy,Vegetarian
Baked Banana Chips Recipe,Spicy,Vegetarian
Tamil Nadu Style Pulses Broth Recipe - Fruit Lentil Surri,Spicy,Non-Vegetarian
Potato And Paneer Reuben Sandwich Recipe,Non-Spicy,Vegetarian
Mangalorean Chana Gassi Recipe,Spicy,Vegetarian
Tisrayanche Suke Recipe (Goan Clams Dry),Spicy,Non-Vegetarian
Eggless Spiced Carrot Olive Cake Recipe,Non-Spicy,Vegetarian
Stuffed Capsicum With Sweet Potato Recipe,Spicy,Vegetarian
Kumbakonam Filter Coffee Recipe,Spicy,Vegetarian
Assamese Fish Fried Rice Recipe,Spicy,Non-Vegetarian
Chettinad Style Puliogare Gojju Recipe,Spicy,Vegetarian
Moong Sprouts Pulao Recipe,Spicy,Vegetarian
Grated Cucumber Raita Recipe,Spicy,Vegetarian
Whole Wheat Stuffed Breadsticks Recipe,Spicy,Vegetarian
Andhra Style Makka Garelu Recipe (Corn Vada Recipe),Spicy,Vegetarian
Pineapple Cucumber Salad Recipe With Lemon Dressing,Spicy,Vegetarian
Pull Apart Bread With Basil Pesto Recipe,Non-Spicy,Vegetarian
Millet Pumpkin Bread Recipe - Millet Pumpkin Bread Recipe,Spicy,Vegetarian
Fenugreek salt pare recipe,Spicy,Vegetarian
Easy Sabudana Vada With Arrowroot Powder Recipe,Spicy,Vegetarian
Cheese Balls With Capsicum Recipe,Spicy,Vegetarian
Andhra Style Pulihora Recipe (Spicy & Tangy Tamarind Rice),Spicy,Vegetarian
Achappam Recipe | Kerala Style Fried Rose Cookies,Spicy,Non-Vegetarian
Kerala Style Mutton Stew Recipe,Spicy,Non-Vegetarian
Vazhaipoo Vadai Recipe (Banana Flower Fried Savoury Snack),Spicy,Vegetarian
Khira Gaintha Recipe - Rice Dumplings In Sweetened Milk,Spicy,Vegetarian
Foxtail Millet Nucchina Unde Recipe (Foxtail Millet and Lentil Dumplings),Spicy,Vegetarian
Senai Pachadi Recipe (Elephant or Raita),Spicy,Vegetarian
Pumpkin Stew With Chickpeas Recipe,Spicy,Vegetarian
Schezwan Style Chinese Veg Samosa Recipe - Roz Ka Khana with Figaro Olive Oil,Spicy,Vegetarian
Mexican Sizzler Recipe,Spicy,Vegetarian
Pudina Rasam Recipe - Mint Leaves Rasam,Spicy,Vegetarian
Ceylon Egg Parotta Recipe,Spicy,Non-Vegetarian
Tomato Tarts Recipe,Non-Spicy,Vegetarian
Eggless Saffron Laced Almond Cookies Recipe,Non-Spicy,Vegetarian
Aubergine Layered Baked Corn Cheese Quinoa Pasta Recipe,Spicy,Non-Vegetarian
Corn Okra Recipe,Spicy,Vegetarian
Broccoli Cheese Mayo Sandwich Recipe,Spicy,Non-Vegetarian
Pesto Pizza With Mushroom And Bell Pepper Recipe,Spicy,Vegetarian
Broccoli Capsicum Pulao Recipe,Spicy,Vegetarian
Maple Roasted Cinnamon Spiced Latte Recipe,Non-Spicy,Vegetarian
Raw Mango Coconut Chutney Recipe,Spicy,Vegetarian
Nolen Chawal Bhog Recipe (Rice Pudding With Nolen Jaggery),Non-Spicy,Vegetarian
Makhana Aloo Tikki Recipe (Spiced Lotus Seed Patties Recipe),Spicy,Vegetarian
Peanut Chutney Podi Recipe,Spicy,Vegetarian
Chicken Pasanda Recipe,Spicy,Non-Vegetarian
Udupi Style Sambar Recipe - Masala Huli With Mixed Vegetables,Spicy,Vegetarian
Tandoori Potato Wedges Recipe,Spicy,Vegetarian
Hariyali Chicken Tikka Recipe,Spicy,Non-Vegetarian
Semma Rice Coconut Milk Sauce Recipe- Red Rice Sauce,Spicy,Vegetarian
Badam Milk Recipe - Almond Milk,Non-Spicy,Vegetarian
Spicy Potato Chutney Sandwich Recipe,Spicy,Vegetarian
Andhra Style Urlugadda Munagakaya Charu Recipe - Potato And Drumstick Gravy,Spicy,Vegetarian
Shredded Mutton With Caramelized Onions Recipe,Spicy,Non-Vegetarian
Kathirikai Poondu Pirattal Recipe - South Indian Style Brinjal Stir Fry With Garlic,Spicy,Vegetarian
Roasted Carrot & Green Pepper Hummus Recipe,Spicy,Vegetarian
Broken Wheat and Mixed Millet Upma Recipe,Spicy,Vegetarian
Herb & Cheese Mushroom Omelette Recipe,Spicy,Non-Vegetarian
Quick And Easy Baked Beans Shakshuka Recipe,Spicy,Non-Vegetarian
Bengali Aloo Jhinge Posto Curry Recipe (Potato and Ridge Gourd Curry),Spicy,Vegetarian
Bhogichi Bhaji Recipe (Maharashtrian Mixed Vegetable Stir Fry),Spicy,Non-Vegetarian
Sweet Corn And Raw Mango Salad Recipe,Spicy,Vegetarian
Crunchy Creamy Coleslaw Recipe,Spicy,Non-Vegetarian
Maharastrian Style Bharli Bhindi Recipe - Stuffed Bhindi With Coconut,Spicy,Vegetarian
Mixed Vegetable Akki Roti Recipe,Spicy,Vegetarian
Bitter Gourd Peel Puri Recipe,Spicy,Vegetarian
"Green Apple, Radish & Pepper Salad Recipe",Spicy,Vegetarian
Mangalore Cucumber Chana Dal Subzi Recipe,Spicy,Vegetarian
Bitter gourd poriel recipe - Pavakkai Poriyal Recipe,Spicy,Vegetarian
Bengali wash recipe,Spicy,Vegetarian
Mushroom Curry Recipe,Spicy,Vegetarian
Pudina Sooji & Oats Dhokla Recipe - Steamed Semolina Cake With Oats & Mint Leaves,Spicy,Vegetarian
Rajma and Corn Salad Recipe,Spicy,Vegetarian
Besan Katli Ki Sabzi Recipe,Spicy,Vegetarian
Bengali Style Khichuri Aar Labra Recipe-Khichdi And Mixed Vegetables,Spicy,Non-Vegetarian
Parwal Ki Mithai Recipe -Pointed Gourd Sweet,Non-Spicy,Vegetarian
Chicken & Bell Pepper Skewers Recipe,Spicy,Non-Vegetarian
Broken Wheat And Apple Porridge Recipe,Non-Spicy,Vegetarian
Classic Banana Walnut Steamed Bread Recipe in Preethi Electric Pressure Cooker,Non-Spicy,Non-Vegetarian
Pathare Prabhu Roath Recipe (Semolina Cake),Non-Spicy,Vegetarian
Mee Bakso Recipe - Indonesian Meatball Noodle Soup,Spicy,Non-Vegetarian
Zesty Fish Quiche Recipe Flavored With Cheesy Garlic Mayo,Spicy,Non-Vegetarian
Ice Cream Cake Recipe With Chocolate Mocha Frosting,Spicy,Vegetarian
Spinach & Apple Salad Recipe With Orange Dressing,Spicy,Vegetarian
Homemade Roasted Bell Pepper Pasta Sauce Recipe,Spicy,Vegetarian
Kacche Aam Ki Launji Recipe,Spicy,Vegetarian
Lemongrass Tomato Corn Soup Recipe,Spicy,Vegetarian
Mulangi Thoran Recipe - Radish Stir Fry With Coconut,Spicy,Vegetarian
Bellada Coffee Recipe With Milk (Karnataka Style Filter Coffee With Jaggery),Spicy,Vegetarian
Kadhi Pakora Recipe,Spicy,Vegetarian
Spicy Potato Wraps Recipe,Spicy,Vegetarian
 Bitter Gourd Chips Recipe,Spicy,Vegetarian
Beetroot Rosti Recipe,Spicy,Non-Vegetarian
Stuffed Mushrooms With Spinach & Parmesan Recipe,Spicy,Vegetarian
Broccoli Cream Kofta Recipe,Spicy,Vegetarian
Sweet Potato Flatbread Recipe - Sweet Potato Chapati,Spicy,Vegetarian
Kerala Style Appam Recipe Without Yeast,Non-Spicy,Vegetarian
 Senai Kizhangu Varuval Recipe,Spicy,Vegetarian
Eggless Peach Cobbler Recipe,Non-Spicy,Vegetarian
Chicken And Egg Soup Recipe,Spicy,Non-Vegetarian
Tomato Chole Recipe,Spicy,Vegetarian
Horsegram Dal Recipe - Kulith/Kollu Dal,Spicy,Vegetarian
Herbed Muffins With Cheese Recipe,Spicy,Vegetarian
 Broccoli Rava Idli Recipe,Spicy,Vegetarian
Kobbari Charu Recipe - Coconut Milk & Dal Sambar Recipe,Spicy,Vegetarian
Eggless Dark Chocolate Cookies With Almonds Recipe,Spicy,Vegetarian
Super Food Green Smoothie Recipe With Greek Yogurt Papaya Spirulina & Wheat Grass,Non-Spicy,Vegetarian
Sweet Lime Soda Recipe,Spicy,Vegetarian
Konaseema Kodi Kura Recipe - Andhra Style Chicken Curry,Spicy,Non-Vegetarian
Malai Kofta Curry Recipe - Creamy and Healthy Paneer Aloo Kofta Curry,Spicy,Vegetarian
Achari Masala Powder Recipe,Spicy,Vegetarian
Konkani Style Alasande Randayi Recipe-Black Eyed Beans and Yam Gravy,Spicy,Vegetarian
Sweet And Spicy Tofu Salad With Beetroot Recipe,Spicy,Vegetarian
Madras Lamb Curry Recipe,Spicy,Non-Vegetarian
Moolangi Tovve Recipe - Radish Curry,Spicy,Vegetarian
Carrot And Broccoli Poriyal Recipe,Spicy,Vegetarian
Cabbage & Buttermilk Curry Recipe,Spicy,Vegetarian
Kheel Paniyaram Recipe (Puffed Rice Paniyaram),Spicy,Vegetarian
Dhaba Style Dal Fry Recipe,Spicy,Vegetarian
Ragi Onion Uttapam Recipe - Wholesome Breakfast Recipe,Spicy,Vegetarian
Sabudana Vada Recipe - Deep Fried Sago Patties/Cutlets,Spicy,Vegetarian
"Ragi, Wheat & Oat Waffles Recipe With Maple Syrup",Spicy,Non-Vegetarian
Oats and Vegetable Kebab Recipe,Spicy,Vegetarian
 Chana Methi Dal (Recipe In Hindi),Spicy,Vegetarian
Creamy Alfredo Cauliflower Pasta Recipe,Spicy,Vegetarian
Nolen Gurer Payesh Recipe,Non-Spicy,Vegetarian
Akuri Recipe (Parsi Style Seasoned Scrambled Eggs),Spicy,Non-Vegetarian
Gujarati Mooli Bajra Muthia Recipe - Radish And Bajra-Besan Dmplings,Spicy,Vegetarian
Spicy Chana Chaat Frankie Recipe,Spicy,Vegetarian
Chow Chow Milagu Kootu Recipe-Chayote Squash Cooked in Peppery Lentil Curry,Spicy,Vegetarian
Panjiri Recipe - Healthy Punjabi Dry Fruit Snack,Non-Spicy,Vegetarian
Overnight Oats Recipe (No Cook Blueberry Vanilla and Chia seeds Oatmeal),Non-Spicy,Vegetarian
 Matar Poha (Recipe In Hindi),Spicy,Vegetarian
Baked Lebanese Pumpkin Kibbi Recipe,Spicy,Vegetarian
Cheese Garlic Naan Recipe,Spicy,Vegetarian
Andhra Style Green Chilli Chicken Recipe,Spicy,Non-Vegetarian
Paneer Biryani Recipe,Spicy,Vegetarian
Ilish Pulao Recipe - Bengali Style Hilsa Fish Pilaf,Spicy,Non-Vegetarian
Nihari Gosht Recipe,Spicy,Non-Vegetarian
Nankhatai Recipe - A Spiced Eggless Indian Cookie,Spicy,Vegetarian
Chickpea Flour Crepes Recipe With Salad And Chutney Spread,Spicy,Vegetarian
Tamil Nadu Style Paneer Kurma Recipe,Spicy,Vegetarian
Pudina Buttermilk Recipe,Non-Spicy,Vegetarian
Mushroom And Quail Egg Gougere Recipe,Spicy,Non-Vegetarian
Kashmiri Paneer Gravy Recipe,Spicy,Vegetarian
Spicy Onion Tomato Masala Sandwich Recipe,Spicy,Vegetarian
Crispy Oven Roasted Curried Chickpeas Recipe,Spicy,Vegetarian
Rose Flavoured Shahi Tukda Recipe,Non-Spicy,Vegetarian
Watermelon Rasam Recipe,Spicy,Vegetarian
Bannada Saute Majjige Huli Recipe (Malabar Cucumber Mor Kuzhambu),Spicy,Vegetarian
Tamatar Gosht Recipe-Mutton In Tomato Curry,Spicy,Non-Vegetarian
 Masala Chaas Recipe,Spicy,Vegetarian
Karnataka Style Harive Soppu Bendi Recipe (Amaranth Leaves Cooked in Coconut Broth),Spicy,Vegetarian
 Matar Masala Recipe,Spicy,Vegetarian
Pesara Pappu Pulusu Recipe,Spicy,Vegetarian
Moong Bhajji Recipe-Moong Fritters,Spicy,Vegetarian
Kumror Chokka Recipe - Kaddu Kala Chana Sabzi | Pumpkin Chickpea Curry,Spicy,Vegetarian
Spicy Jalapeno Scrambled Eggs Recipe,Spicy,Non-Vegetarian
"Oats, Peas & Tofu Stuffed Paratha Recipe",Spicy,Vegetarian
Plum Galette Recipe With A Flaky Whole Wheat Pie Crust,Non-Spicy,Vegetarian
Vadyancho Ross Recipe (Ash Gourd Chips Curry),Spicy,Vegetarian
Kadale Chutney Recipe - Fried Gram Chutney,Spicy,Vegetarian
 Spicy Potato Roast Recipe (Recipe In Hindi),Spicy,Vegetarian
Roasted Tomato And Mozzarella Caprese Salad With Basil Balsamic Vinegar Recipe,Spicy,Vegetarian
Sichuan Dan-Dan Noodles Recipe (Sesame Noodles With Crispy Tofu Recipe),Spicy,Non-Vegetarian
Spaghetti Pasta Recipe in Basil Pesto Sauce,Spicy,Vegetarian
Chicken Xacuti Recipe - Goan Chicken Gravy,Spicy,Non-Vegetarian
Punjabi Mixed Vegetable Kadai Recipe,Spicy,Vegetarian
 Soya Chunks Sabzi (Recipe In Hindi),Spicy,Vegetarian
 Veg Makhanwala Recipe,Spicy,Vegetarian
Goan Vegetable Curry Recipe,Spicy,Vegetarian
Chicken Rendang Recipe - Malaysian-Indonesian Chicken Stew,Spicy,Non-Vegetarian
Chocolate And Oats Christmas Cookie Cake Recipe,Spicy,Vegetarian
Nepalese Mutton Curry Recipe,Spicy,Non-Vegetarian
Beetroot Stew with Coconut Milk Recipe (With a South Indian Flavor),Spicy,Vegetarian
Stuffed Jacket Potatoes Recipe,Spicy,Vegetarian
Palak Puri Recipe (Crispy Spinach Puri Snack),Spicy,Vegetarian
Guilt Free Fruit Cream Recipe,Non-Spicy,Vegetarian
Greek Style Gigantes Plaki Recipe-Oven Baked Broad Beans with Vegetables,Spicy,Vegetarian
Laal Maas Biryani Recipe,Spicy,Non-Vegetarian
Makhana Badam Mixture Recipe - Healthy Snack/ Trail Mix,Non-Spicy,Vegetarian
Ridge Gourd Pachadi Recipe - Ridge Gourd Chutney,Spicy,Vegetarian
Kashmiri Style Rista Recipe - Mutton Kofta Curry,Spicy,Non-Vegetarian
Ayala Fish Fry Recipe,Spicy,Non-Vegetarian
