TranslatedRecipeName,Spice Tolerance,Dietary Preference
Masala Karela Recipe,Spicy,Vegetarian
Spicy Tomato Rice (Recipe),Spicy,Vegetarian
Ragi Semiya Upma Recipe - Ragi Millet Vermicelli Breakfast,Spicy,Vegetarian
Gongura Chicken Curry Recipe - Andhra Style Gongura Chicken,Spicy,Non-Vegetarian
Andhra Style Alam Pachadi Recipe - Adrak Chutney (Recipe),Spicy,Vegetarian
Pudina Khara Pongal Recipe (Rice and Lentils Cooked With Mint Leaves & Mild Spices),Spicy,Vegetarian
Udupi Style Ash Gourd Coconut Curry Recipe,Spicy,Vegetarian
Mexican Style Black Bean Burrito Recipe,Spicy,Vegetarian
Spicy Crunchy Masala Idli Recipe,Spicy,Vegetarian
Cauliflower Leaves Chutney (Recipe in Hindi),Spicy,Vegetarian
Homemade Baked Beans Recipe (Wholesome & Healthy),Spicy,Vegetarian
Veg Chili Cheese Burgers Recipe,Spicy,Non-Vegetarian
Andhra Steel Ingavu Charu Recipe - Asfoitida Flavored Tamarand Rasam,Non-Spicy,Vegetarian
And fish soup recipe - Bengali style fish in tomato gravy,Spicy,Non-Vegetarian
Saunf Aloo (Fennel Potato Curry) Recipe,Spicy,Vegetarian
South Indian Onion Chutney Recipe - South Indian Onion Chutney (Recipe),Spicy,Vegetarian
Hariyali Egg Curry Recipe In Coriander and Mint Gravy,Spicy,Non-Vegetarian
Gourd Raita Recipe - Grated Bottle Gourd Yogurt Salad,Spicy,Vegetarian
Homemade Tater Tots Recipe,Spicy,Vegetarian
Chettinad Vegetable Casserole Recipe - Chettinad Vegetable Pulao Recipe,Spicy,Vegetarian
Garlic Amla Chutney Recipe - Lehsun Amla Chutney Recipe,Spicy,Vegetarian
Maharashtrian Kakdi Thalipeeth Recipe - Spiced Cucumber Flat Bread,Spicy,Vegetarian
Homemade Healthy Subway Sandwich Recipe With Beet & Sprout,Spicy,Vegetarian
South Indian Style Murungakkai Poriyal Recipe - Drumstick Stir Fry,Spicy,Vegetarian
Kesar Mango Lassi Recipe - Saffron Mango Lassi Recipe,Non-Spicy,Vegetarian
Chettinad Sweet Paniyaram Recipe - Chettinad Sweet Paniyaram Recipe,Non-Spicy,Vegetarian
Mini Dal Samosa Curry / Sabzi Recipe,Spicy,Vegetarian
Spinach Garlic Bruschetta Recipe With Red Bell Pepper Sauce,Spicy,Vegetarian
Mini Dal Mature Chat Recipe - That Perfect Party Snack,Spicy,Vegetarian
Asian Style Sweet & Spicy Green Beans Recipe,Spicy,Vegetarian
Chinese Darsaan Recipe With Ice Cream,Non-Spicy,Vegetarian
Sundakkai and Methi Leaves Sambar Recipe - Sundkai Methi Sambar Recipe,Spicy,Vegetarian
"Cabbage, Spinach, Pomegranate Slaw with Lemon Dressing Recipe",Spicy,Vegetarian
Matar Samosa Recipe -Green Pea Samosa,Spicy,Vegetarian
Eggless Chocolate Cupcakes With Raspberry & Cheese Frosting,Non-Spicy,Vegetarian
Kerala pala pradham recipe,Spicy,Vegetarian
Tindora Sambharo Recipe - Instant Tendli Pickle,Spicy,Vegetarian
Chettinad Style Chicken Roast Recipe,Spicy,Non-Vegetarian
Palakottai Kujambu Recipe-Kongunad Style Jackfruit Seeds Curry,Spicy,Vegetarian
Baingan Bharta Recipe - Brinjal Bharta Recipe,Spicy,Non-Vegetarian
Kesar Chai Recipe - A Delicious Saffron Flavored Indian Tea,Non-Spicy,Vegetarian
Pacha Manga Pachadi Recipe - Tamil Nadu Raw Mango Pachadi Recipe,Spicy,Vegetarian
Short Knot Husband Recipe - Raw Jackfruit & Black Chickpea Stir Fry,Spicy,Vegetarian
Whole Wheat Crepe Recipe With Herbed Vegetables,Spicy,Vegetarian
Makki and Methi Roti Recipe,Spicy,Vegetarian
Cabbage and Carrot Sambharo Recipe - Gujarati Vegetable Stir Fry,Spicy,Vegetarian
Whole Wheat Pita Bread Recipe,Non-Spicy,Vegetarian
Andhra Steel Tomato Knock Recipe (Tomato Chutney),Spicy,Vegetarian
Herbal Brown Rice Recipe - Herbal Brown Rice Recipe,Spicy,Vegetarian
Rajasthani very roti recipe,Non-Spicy,Vegetarian
Peerkangai Thogayal Recipe (Ridge Gourd Peel Chutney),Spicy,Vegetarian
Dalia Pakora Recipe - Dalia Pakora Recipe,Spicy,Vegetarian
Paneer Tikka Saddle Roll Recipe,Spicy,Vegetarian
Pan Fried Rice Balls Filled With Cheese Recipe,Spicy,Non-Vegetarian
Spicy Seafood Stew Casserole With Tomatoes And Lime Recipe,Spicy,Non-Vegetarian
Spicy Chilli Garlic Noodles Recipe,Spicy,Vegetarian
Chanar Dal Recipe - Bengali Steel Paneer & Potato Gravy,Spicy,Vegetarian
Cheesy Garlic Broccoli Nuggets Recipe,Non-Spicy,Vegetarian
Bengali radish potato vegetable recipe,Spicy,Vegetarian
Beetroot Sambar Recipe,Spicy,Vegetarian
Kaddu Palak Roti Recipe (Pumpkin Spinach Flat Bread),Spicy,Vegetarian
Iranian Baida Curry Recipe,Spicy,Non-Vegetarian
Vegan Chickpea Omelette Recipe (Spiced Chickpea Flour Pancakes),Spicy,Vegetarian
Peanut Pudding Recipe - Salt Pudding / Firm Mod Modak,Spicy,Vegetarian
Singapore Style Chicken Layered Fried Rice Recipe,Spicy,Non-Vegetarian
Tofu Pulao Recipe,Spicy,Vegetarian
Masala Sandwich Recipe With Rocket Leaves,Spicy,Vegetarian
Tomato Relish Recipe,Spicy,Vegetarian
Dubuk Vade Recipe - Khandeshi Gram Flour Dumpling Curry,Spicy,Vegetarian
Radish Soup Recipe,Spicy,Vegetarian
Mango Donut Cake Recipe With Chocolate Glaze,Non-Spicy,Vegetarian
Matar Paneer Kachori Korma Recipe - Green Peas And Paneer Kachori Curry,Spicy,Vegetarian
Zucchini Roll Up Lasagne Recipe,Spicy,Vegetarian
Thengai Sadam Recipe (A Quick and Healthy Coconut Rice),Spicy,Vegetarian
Karwar Style Ambade Udid Methi Recipe - Hog Plum Curry,Spicy,Vegetarian
Roasted Cauliflower Recipe,Spicy,Vegetarian
Pain Viennois | Vienna Bread Recipe,Non-Spicy,Non-Vegetarian
Crunchy Ginger Capsicum Rice Recipe,Spicy,Vegetarian
Bengali Chirer Payesh / Poha Pudding Recipe With Nolen Gur,Spicy,Vegetarian
Shanghai Style Chap Nian Gao Recipes (Stir Fried Rice Cakes Recipes),Spicy,Vegetarian
White Pumpkin Mor Kuzhambu Recipe - Kerala Style White Pumpkin Curry,Spicy,Vegetarian
Paneer and Green Peas Paratha Recipe - Paneer and Green Peas Paratha Recipe,Spicy,Vegetarian
Elephant Yam Raita (Recipe In Hindi),Spicy,Vegetarian
Drunken Noodles Recipe - Drunken Noodles Recipe,Spicy,Non-Vegetarian
Chettinad Style Prawn Biryani Recipe,Spicy,Non-Vegetarian
Walnut and Flax Seed Trail Mix Recipe With Figs and Honey,Non-Spicy,Vegetarian
Murgh Malaiwala Recipe - Chicken In Rich Creamy Gravy,Spicy,Non-Vegetarian
Paal Kesari Recipe - South Indian Style Milk Kesari,Non-Spicy,Vegetarian
Spicy Lemon Chicken Kebab Recipe,Spicy,Non-Vegetarian
Paneer Butter Masala Biryani Recipe - Layered Paneer Butter Masala Biryani Recipe,Spicy,Vegetarian
Gond Ke Ladoo Recipe - Edible Gum Ladoo,Spicy,Vegetarian
Kobari Charu recipe - Kobbari Charu Recipe,Spicy,Vegetarian
Basil Tincture Recipe (Or) - Herbal Drink From Basil,Spicy,Vegetarian
Carrot Corn Mayo Pancake Recipe With Sandwich Spread,Spicy,Non-Vegetarian
Tamil Nadu Style Spicy Egg Fry Recipe,Spicy,Non-Vegetarian
Chirer Dudh Puli Recipe - Bengali Style Baten Rice Dumpling Milk,Spicy,Vegetarian
Waffle Broth Recipe - Puppet's Yamarinta Crovy,Spicy,Vegetarian
Kashmiri Style Modur Pulao With Pomegranate Recipe,Non-Spicy,Vegetarian
North Indian Style Mushroom Matar Masala Recipe,Spicy,Vegetarian
Dhania Chole Masala Recipe - Chickpeas In Fresh Coriander Gravy,Spicy,Vegetarian
Capsicum Masala Poriyal (Recipe in Hindi),Spicy,Vegetarian
Kerala Style Raw Banana and Suran Kotu Curry Recipe - Kerala Style Plantain & Yam Thoran Recipe,Spicy,Vegetarian
Cheese Stuffed Aloo Bonda Recipe,Spicy,Vegetarian
Dahi Wale Paneer Recipe - Paneer In A Curd Gravy,Spicy,Vegetarian
Nutty Aloo Paratha Recipe,Spicy,Vegetarian
Chicken Tikka Taco Recipe Topped With Cheesy Garlic Mayo,Spicy,Non-Vegetarian
Masalewali Turai Sabzi Recipe - Masalawali Turai Sabzi Recipe,Spicy,Vegetarian
Pudina Mushroom And Soya Biryani Recipe,Spicy,Vegetarian
White Vegetable Kurma Recipe With Coconut & Cashew,Spicy,Vegetarian
Muttaikose Poriyal Recipe - Cabbage Stir fry With Coconut,Spicy,Vegetarian
Bengaluru Style Brinjal Gravy Recipe - For Biryani,Spicy,Non-Vegetarian
PF Chang's Style Crispy Chicken Lettuce Wraps Recipe,Spicy,Non-Vegetarian
Lemon Frozen Yogurt Recipe,Non-Spicy,Vegetarian
Paneer Capsicum Sandwich Recipe,Spicy,Vegetarian
Dry Suran Masala Vegetable Recipe,Spicy,Vegetarian
One Pot Pressure Cooker Chicken Curry Recipe - One Pot Pressure Cooker Chicken Curry Recipe,Spicy,Non-Vegetarian
Lauki Ka Salan Recipe - Bottle Gourd Salan Recipe,Spicy,Vegetarian
Togari Bell Thove Recipe - Tour Dal Juice,Spicy,Vegetarian
Chicken Shawarma Recipe,Spicy,Non-Vegetarian
Mushroom Paratha Recipe,Spicy,Vegetarian
Palak Chana Dal Recipe - Healthy Spinach Gram Dal Recipe,Spicy,Vegetarian
Pasi Paruppu Kosumalli Recipe (Spiced Lentil Salad Recipe),Spicy,Vegetarian
Maharashtrian Style Semolina and Yogurt Cake Recipe,Non-Spicy,Vegetarian
Ragi Masala Roti Recipe,Spicy,Vegetarian
Dry Sweet Potato Thoran Recipe,Spicy,Vegetarian
Oreo Milkshake Recipe,Non-Spicy,Vegetarian
Mexican Grilled Corn Flavoured With Cheesy Garlic Mayo Recipe,Spicy,Vegetarian
Paneer Matar Butter Masala (Indian Cottage Cheese and Peas Masala With Butter) Recipe,Spicy,Vegetarian
Dhugare Baingan Recipe - Dhungare Baingan Recipe,Spicy,Non-Vegetarian
Rajasthani Style Dried Gatta Capsicum Vegetable Recipe,Spicy,Vegetarian
Indo Chinese Crispy Chicken Chilli Recipe,Spicy,Non-Vegetarian
And fish soup recipe - Bengali fish curry,Spicy,Non-Vegetarian
Stem Lettuce Tamarind Broth Recipe - Surri left behind by Amarnath Greens,Spicy,Vegetarian
Crispy Masala Peanuts Recipe - Gujarati Sing Bhujia,Spicy,Vegetarian
Maa Ki Dal (Recipe),Spicy,Non-Vegetarian
Palak Mushroom Makhani Recipe - Creamy Spinach & Mushroom,Spicy,Vegetarian
Dahi Bhalla Papdi Chaat Recipe,Non-Spicy,Vegetarian
Wheat Grass Shikanji - Wheat Grass Lemonade Recipe,Spicy,Vegetarian
Chole Masala Recipe - Dry Masala Chickpeas (Recipe),Spicy,Vegetarian
Rajasthani Kachri Chutney Recipe - Rajasthani Kachri Ki Chutney Recipe,Spicy,Vegetarian
Fasting Potato Paneer Recipe - Potato Paneer Curry Without Onion And Garlic Recipe,Spicy,Vegetarian
 Katachi Amti (Recipe In Hindi),Spicy,Vegetarian
Khara Obbattu Recipe (Bread Stuffed With Spicy Potato Mixture Recipe),Spicy,Vegetarian
Cauliflower Matar Bhurji (Recipe in Hindi),Spicy,Vegetarian
Kashmiri Style Paneer Masala Recipe,Spicy,Vegetarian
Aromatic Vegetable Pulao Recipe,Spicy,Vegetarian
Spicy Curd Recipe - Spicy Curd With Onions,Spicy,Vegetarian
Mustard Vegetable Curry Recipe,Spicy,Vegetarian
One Pot Spicy Vegetable Pulao Recipe with Coconut Milk,Spicy,Vegetarian
Bengali Aloo Dum Recipe - Bengali Aloo Dum Recipe,Spicy,Vegetarian
Hyderabad Soy Biryani Recipe With Vegetables & Palak,Spicy,Vegetarian
North Indian Feni Recipe - Sevaiyan Kheer,Spicy,Vegetarian
South Indian Papad Curry Recipe - Appalam Vathal Kuzhambu (Recipe),Spicy,Vegetarian
Moong Dal Khichdi Recipe For Babies And Toddlers Over 10 Months,Non-Spicy,Vegetarian
Dahi Wale Aloo Recipe (Indian Yogurt-based Potato Curry),Spicy,Vegetarian
Vegetable Fried Brown Rice Recipe,Spicy,Vegetarian
Eggless Devil's Food Cake Recipe,Non-Spicy,Non-Vegetarian
Bengali Langcha Recipe With Mawa,Spicy,Vegetarian
Kovakkai Podi Curry Recipe - Tamil Nadu Style Ivy Gourd Stir Fry,Spicy,Vegetarian
Biryani Masala Powder Recipe - Biryani Masala Powder Recipe,Spicy,Vegetarian
"Chicken Sausages, Baked Beans and Stir Fried Broccoli Recipe",Spicy,Non-Vegetarian
Crispy Chicken Dumplings Recipe,Spicy,Non-Vegetarian
Turkish Chicken Gozleme Recipe-Stuffed Spinach Chicken Bread,Spicy,Non-Vegetarian
Moon Biscuits Recipe (Moon Shaped Baked Cookies),Non-Spicy,Vegetarian
Andaman Style Steamed Garlic Prawns Recipe,Spicy,Non-Vegetarian
Fruit Pachadi Recipe,Spicy,Vegetarian
Aloo Matar Masala Khichdi Recipe,Spicy,Vegetarian
Rock Toast Recipe - Semolina Bread Toast,Spicy,Vegetarian
Potato Vindaloo Recipe (Spicy Goan Potato Curry),Spicy,Vegetarian
Lu Potol Post Recipe (Lu Parwal In Poppy Seed Masala Recipe),Spicy,Vegetarian
Aloo Bhey Ki Sabzi Recipe (Potato Lotus Stem Curry),Spicy,Vegetarian
Classic Grilled Tomato Cucumber Chutney Sandwich Recipe,Spicy,Vegetarian
Homemade Granola Mix Recipe with Oats & Wheat Flakes,Non-Spicy,Vegetarian
Baingan Sarson Ka Saag Recipe,Spicy,Non-Vegetarian
Kalyana Veetu Senai Curry Recipe - South Indian Spicy Roasted Yam,Spicy,Vegetarian
Chettinad Thakkali Sadam Recipe (Chettinad Style Tomato Rice),Spicy,Vegetarian
Thai Yellow Coconut Curry Rice Recipe,Spicy,Vegetarian
 Stuffed Bhindi With Paneer (Recipe In Hindi),Spicy,Vegetarian
Bael Ka Sharbat Recipe - Wood Apple Squash Drink,Non-Spicy,Vegetarian
Raw Mango Murabba Recipe - Cinnamon Spiced Mango Jam,Spicy,Vegetarian
Karnataka Style Gorai Kai Kara Recipe - Cluster Beans Chutney,Spicy,Vegetarian
Kunafa With Mango Cottage Cheese Cream Recipe,Spicy,Vegetarian
Royal Bread Gulab Jamun Recipe,Non-Spicy,Vegetarian
Safed Achari Baingan Recipe - White Aubergine in pickled spices,Spicy,Non-Vegetarian
Potlankaya Perugu Pachhadi Recipe (Curd & Sunke Gourad Chutney),Spicy,Vegetarian
Karela Dahi Puri Recipe - A Chatpata Chaat Made From Bitter Gourd,Spicy,Vegetarian
Kasuri Methi and Potato Frying Recipe,Spicy,Vegetarian
Sprouted Matki Chila Recipe with Spinach - Moth Bean Chila,Spicy,Vegetarian
Malabar Kaai Curry Recipe With Nenthra Pazham,Non-Spicy,Vegetarian
Assamese Sweet Kordoi Recipe,Non-Spicy,Vegetarian
Steamed Bafauri Recipe (Bhojpuri Style Steamed Chana Dal Balls),Spicy,Vegetarian
Jodhpuri Aloo Recipe,Spicy,Vegetarian
Vedakkai Thoran Recipe - Kerala Style Bhindi Stir Fry,Spicy,Vegetarian
Gram and Potato Dry Vegetable Recipe,Spicy,Vegetarian
Tomato Chicken Roast Recipe Flavoured With Kasuri Methi,Spicy,Non-Vegetarian
Nellikai Oorugai / Amla Sambhario Recipe (Instant Gooseberry Piccile Recipe),Spicy,Vegetarian
Baingan Sarson Ka Saag Recipe - Brinjal Mustard Saag Recipe,Spicy,Non-Vegetarian
Stuffed Arbi Paratha Recipe,Spicy,Vegetarian
Tomato Curry Leaf Chutney Recipe - Tomato Curry Leaf Chutney Recipe,Spicy,Vegetarian
Rajasthani Goonde Vegetable Recipe (Bird Lime Stir Fry),Spicy,Vegetarian
Raw Jackfruit Burrito Recipe,Spicy,Non-Vegetarian
Bengali gram dal recipe,Spicy,Vegetarian
Hyderabadi Vegetable Biryani Recipe - Hyderabadi Vegetable Biryani Recipe,Spicy,Vegetarian
Chocolate Chip & Raisin Rolls Recipe,Non-Spicy,Vegetarian
Baby Corn Cigar Recipe,Spicy,Vegetarian
Wheat Millet Thepla Recipe - Bajra Masala Paratha,Spicy,Vegetarian
Kaju Badam Ladoo Recipe,Spicy,Vegetarian
Spaghetti Aglio Olio With Parmesan & Greens Recipe,Spicy,Vegetarian
Mushroom Dumpling Recipe With Potatoes (Momos),Spicy,Vegetarian
Tomato Curry Leaf Chutney With No Onion No Garlic Recipe,Spicy,Vegetarian
Baked Oats and Whole Wheat Kachori Stuffed with Peas Recipe,Spicy,Vegetarian
Masala Carrot And Peas Sandwich Recipe,Spicy,Vegetarian
Stuffed Onion Vegetable Recipe - Bharwa Pyaz Ki Sabzi Recipe,Spicy,Vegetarian
Aam Panna Pani Puri Recipe,Spicy,Vegetarian
Quinoa Vegetable Upma Recipe,Spicy,Vegetarian
Whole Wheat Espresso Chocolate Streusel Cake Recipe,Non-Spicy,Non-Vegetarian
Basella Fritters Recipe - Malabar Spinach Fritters,Spicy,Vegetarian
Fig Honey & Paprika Preserve Recipe,Spicy,Vegetarian
Sepu Vadi Recipe (Himachali Split Urad Dal Dumplings In Spinach Gravy),Spicy,Vegetarian
Himachali Dry Raw Mango Chutney Recipe,Spicy,Vegetarian
Vegan Navratan Korma Recipe,Spicy,Vegetarian
Lentils and Mixed Grains Khichda Recipe,Spicy,Vegetarian
Chettinad Pakora Curry Recipe,Spicy,Vegetarian
Banana Pomegranate Raita Recipe - Kela Anar Raita,Spicy,Vegetarian
Dhania Wale Aloo Recipe - Coriander Potato Dry,Spicy,Vegetarian
Case Podimas Recipe (South Indian Style Blindine Mash),Spicy,Vegetarian
Baked Potato-Spaghetti Rolls Recipe,Spicy,Vegetarian
Rajasthani Ghasela recipe - Besan Ka Pitta (Recipe in Hindi),Spicy,Vegetarian
Andhra Style Bendakaya Charu Recipe - Ladies Finger Rasam,Spicy,Vegetarian
Mexican Vegetarian Burrito Bowl Recipe,Spicy,Non-Vegetarian
Dahi Bhindi Recipe - Okra in Yogurt Curry with Caramelized Onions,Spicy,Vegetarian
Palak Paneer Bhurji Recipe - Palak Paneer Bhurji Recipe,Spicy,Vegetarian
Badam Halwa Recipe,Non-Spicy,Vegetarian
Sweet & Spicy Vegetable Hong Kong Style Recipe,Spicy,Vegetarian
Badam Halwa Recipe,Non-Spicy,Vegetarian
Tender Coconut Ice Cream Recipe,Non-Spicy,Non-Vegetarian
Milk Powder Chena Burfi Recipe,Non-Spicy,Vegetarian
Carrot Orange Walnut Raita (Fruity Nutty Yogurt) Recipe,Non-Spicy,Vegetarian
Coffee Chocolate Truffles Recipe,Spicy,Vegetarian
Karnataka Style Ragi Ujju Rotti Recipe,Non-Spicy,Vegetarian
Pui Shaker Chorchori Recipe - Mixed Vegetable Curry With Malabar Spinach,Spicy,Non-Vegetarian
Potato Pancakes Recipe,Spicy,Non-Vegetarian
Bamboo Shoot Stir Fry Recipe,Spicy,Vegetarian
Udupi Style Red Parboiled Rice Sevai Recipe (Red Rice Vermicelli),Spicy,Vegetarian
Till Wale Aloo Recipe - Sesame Potato Sabzi,Spicy,Vegetarian
Beetroot Loni Sponge Dosa Recipe,Spicy,Vegetarian
Sweet & Spicy Stuffed Paneer In Kofta Curry Recipe,Spicy,Vegetarian
"Sichuan Style Zhong Shui Jiao Recipe (Caramelized Onion, Cabbage And Peas Dumplings in Red Oil Recipe)",Spicy,Vegetarian
Spicy Baby Potatoes Recipe,Spicy,Vegetarian
Barley Whole Wheat Coffee Marble Cake Recipe,Non-Spicy,Non-Vegetarian
Chettinad Dry Pepper Chicken Recipe,Spicy,Non-Vegetarian
Andhra Style Lettuce Pulp Recipe (Spinach Dal Recipe),Spicy,Vegetarian
Rich Dark Chocolate Mousse Recipe,Non-Spicy,Non-Vegetarian
Hunase Gojju Recipe - Hunase Gojju Recipe,Spicy,Vegetarian
Qahwa | Arabic Coffee Recipe,Spicy,Vegetarian
Broccoli Corn & Barley Soup Recipe,Spicy,Vegetarian
Spirulina and Mint Basil Pesto Pasta Recipe,Spicy,Vegetarian
Goan Style Sando Recipe (Steamed Rice Cakes Filled With Sweet Coconut),Non-Spicy,Vegetarian
"Til Moongphali Aur Kundru Sabzi Recipe - Sesame, Peanuts And Ivy Gourd Stir Fry",Spicy,Vegetarian
Asian Style Honey Soy Sticky Chicken Recipe,Spicy,Non-Vegetarian
Kaigari Pirattal Recipe (Chettinad Style Mixed Vegetables),Spicy,Vegetarian
Pomegranate Frozen Margarita Recipe,Spicy,Vegetarian
Chinese Egg Fried Rice Recipe With Oats,Spicy,Non-Vegetarian
Matar Besan and Paneer Cheela Recipe - Matar Besan and Paneer Cheela Recipe,Spicy,Vegetarian
Leftover Roti Cutlet Recipe,Spicy,Vegetarian
Flourless Orange Cake With Cream Cheese Frosting Recipe,Non-Spicy,Non-Vegetarian
Spicy Paneer Bhurji Pav Sandwich Recipe - Breakfast Recipe,Spicy,Vegetarian
Asian Style Baby Corn With Sesame Seeds and Peanut Sauce Recipe,Spicy,Vegetarian
Papaya and Carrot Halwa Recipe,Non-Spicy,Vegetarian
Phalguni Dal (Recipe),Spicy,Vegetarian
Soft Millet Taco Recipe Topped With Hummus & Veggies,Spicy,Vegetarian
Sprouted Moong And Onion Fritters Recipe,Spicy,Vegetarian
Lemon And Ginger Spicy Black Eyed Beans Recipe,Spicy,Vegetarian
Gawar Phali Masala Sabzi Recipe - Cluster Beans Gravy Sabzi,Spicy,Vegetarian
Corn only quiche recipe,Spicy,Vegetarian
Lacha Onion Recipe - Masala Pickled Onions,Spicy,Vegetarian
Masala Cornflakes Chicken Recipe,Spicy,Non-Vegetarian
Tofu Bhurji Recipe - Spicy Scrambled Tofu,Spicy,Vegetarian
Savoury Bread Pudding Recipe,Spicy,Non-Vegetarian
Stuffed Radish Paneer Paratha Recipe,Spicy,Vegetarian
Orange Peppermint Green Tea Punch Recipe,Spicy,Vegetarian
Zucchini Tater Tots Recipe - A Delicious Party Appetizer,Spicy,Vegetarian
Moringa Masoor Dal Recipe - Drumstick Leaves Dal,Spicy,Vegetarian
Gujarati Methi Na Dhebra Recipe,Spicy,Vegetarian
Rajasthani Gatte Ki Sabzi Recipe With Onion & Garlic,Spicy,Vegetarian
Bengali Aloo Potol er Dalna Recipe - A Traditional Vegetable Side Dish,Spicy,Vegetarian
Egg Sholay Kebab Recipe,Spicy,Non-Vegetarian
One Pot Methi Mushroom Brown Rice Pulao Recipe,Spicy,Vegetarian
Egg and Bread Fried Rice Recipe,Spicy,Non-Vegetarian
Veg Mughlai Paratha Recipe,Spicy,Vegetarian
Crispy Vegetable Tempura Recipe,Spicy,Non-Vegetarian
Andhra Style Stuffed Boils Recipe (Crispy Tapioke Snack),Spicy,Vegetarian
Andhra Style Palakura Vepudu Recipe - Spinach Stir Fry Recipe,Spicy,Vegetarian
Papaya Orange Pomegranate Salad Recipe With Roasted Peanuts,Spicy,Vegetarian
Paka Kela Ki Sabzi Recipe | Paka Kela nu Shaak | Gujarati Jain Recipe,Spicy,Vegetarian
Chocolate Tart Recipe,Spicy,Non-Vegetarian
Navrang dal recipe - Navrang Dal (Recipe),Spicy,Non-Vegetarian
Green Moong Dal Sundal Recipe - Green Moong Dal Sundal Recipe,Spicy,Vegetarian
Chow Chow Sambar Recipe - Chow-Chow Sambar,Spicy,Vegetarian
Tamil Nadu Style White Paniyaram Recipe - Semi Sweet Rice & Dal Printers,Spicy,Vegetarian
Kurkuri Bhindi With Spicy Tomato Yogurt Gravy Recipe,Spicy,Vegetarian
Thulli Recipe (Broken Wheat Halwa),Spicy,Vegetarian
Gulkand Chai Recipe - A Delicious Rose Flavored Indian Tea,Non-Spicy,Vegetarian
Spinach And Tortellini Soup Recipe,Spicy,Vegetarian
Chak-Hao Amubi Recipe (Black Rice Pudding),Spicy,Vegetarian
Four Cheese and Spinach Stuffed Mushrooms Recipe,Spicy,Vegetarian
Roasted Vegetable Pasta Primavera Recipe,Spicy,Vegetarian
Kashmiri Style Chicken Pulao Recipe,Spicy,Non-Vegetarian
Stuffed Tomato With Stir-Fried Quinoa And Feta Recipe,Spicy,Vegetarian
Keeme Ja Bhalla Recipe - Sindhi Mutton Keema Balls In Gravy,Spicy,Non-Vegetarian
Kabuli Chana Sundal Recipe - Chickpea Sundal Recipe,Spicy,Vegetarian
Spinach And Corn Sandwich Recipe Flavored With Sandwich Spread,Spicy,Vegetarian
Spaghetti Pasta Recipe In Roasted Pumpkin Sauce,Spicy,Vegetarian
Cold Potato Salad With Cilantro Dressing Recipe,Spicy,Vegetarian
Pista Burfi Recipe - Indian Spiced Pistachio Fudge,Non-Spicy,Vegetarian
No Onion No Garlic Lobia Masala Recipe In Electric Pressure Cooker,Spicy,Vegetarian
Instant Puliodarai Powder Recipe (Puliogare / Pulihora Powder),Spicy,Vegetarian
Vendakka Stew Recipe (Kerala Style Okra Stew),Spicy,Vegetarian
Party Sev Puri Recipe Filled With Potato & Pomegranate Mint Mayo,Spicy,Vegetarian
Rava Chakli Recipe - Karnataka Style With Rava & Rice Flour,Spicy,Vegetarian
Roasted Chickpeas Recipe,Spicy,Vegetarian
Carrot Chutney Recipe,Spicy,Vegetarian
Peeled Moong Dal Curry Recipe,Spicy,Vegetarian
Chocolate Glazed Coconut Macaroons Recipe,Spicy,Non-Vegetarian
Sookhi Moong Palak Dal Recipe (Whole Green Moong Gram with Spinach),Spicy,Vegetarian
Kerala Style Pacha Mango Avial Recipe,Spicy,Non-Vegetarian
Stuffed Palak Paneer Paratha,Spicy,Vegetarian
Meen Vevichathu Recipe - Kottayam Style Fish Curry,Spicy,Non-Vegetarian
Masoor Dal Gassi Recipe - Masoor Dal Gassi Recipe,Spicy,Vegetarian
Potato Stuffed Dal Dhokli Recipe,Spicy,Vegetarian
Green Chilli Chicken Fry Recipe - Green Chilli Chicken Fry Recipe,Spicy,Non-Vegetarian
Tofu and Chickpea Patty Recipe (Cutlets),Spicy,Vegetarian
Paneer In Coconut Gravy Recipe,Spicy,Vegetarian
Keerai Masiyal Recipe,Spicy,Vegetarian
Thai Som Tum Recipe (Thai Green Papaya Salad),Spicy,Non-Vegetarian
Desiccated Coconut Coriander Chutney Recipe,Spicy,Vegetarian
Quick Masala French Toast Recipe,Spicy,Non-Vegetarian
Kerala Style Tapioca with Coconut Curd Chutney Recipe,Spicy,Vegetarian
Matcha Cookies Recipe,Non-Spicy,Vegetarian
"Corn Salad With Radishes, Jalape�o And Lime In Mint Mayo Recipe",Spicy,Vegetarian
Goan Poee Recipe,Non-Spicy,Vegetarian
Chunky Cucumber Salsa Recipe,Spicy,Vegetarian
Grilled Eggplant With Tahini and Yogurt Dip Recipe,Spicy,Non-Vegetarian
Potato Paneer Curry Without Onion And Garlic Recipe (Vrat Wale Aloo Paneer),Spicy,Vegetarian
Fansi Muthia Nu Shaak Recipe - Green Beans With Gram Flour Dumplings,Spicy,Vegetarian
Kerala Style Appam Recipe - Kerala Style Appam Recipe,Non-Spicy,Vegetarian
Kashmiri Style Shab Deg Recipe-Mutton Kofta and Turnip Curry,Spicy,Non-Vegetarian
Tofu Banh Mi Recipe - Vietnamese Grilled Tofu Sandwich,Spicy,Non-Vegetarian
Sour Sweet Petha Recipe (Yellow Pumpkin Vegetable),Spicy,Vegetarian
Macher Chop Recipe (Bengali Style Fish Croquettes),Spicy,Non-Vegetarian
Mixed Sprouts Sabzi Recipe,Spicy,Vegetarian
Baked Muesli Tart with Strawberry Yogurt and Chia Seeds Recipe,Non-Spicy,Non-Vegetarian
Banoffee Pie Recipe,Spicy,Vegetarian
Himachal Style Khatta Jimikand Recipe - Spicy Tangy Yam,Spicy,Vegetarian
Tulsi and Betel Leaves Rasam Recipe - Tulsi and Betel Leaves Rasam Recipe,Spicy,Vegetarian
Prawn Ghee Roast Recipe,Spicy,Non-Vegetarian
Rosemary Roasted Potatoes And Pepper Salad Recipe,Spicy,Vegetarian
Baked Roasted Vegetable Lasagna Recipe With Low Fat Cheese & Oat Sauce,Non-Spicy,Vegetarian
Dharwad Peda Recipe,Non-Spicy,Vegetarian
Chickpea Coconut Milk Curry Recipe,Spicy,Vegetarian
Vegan Kofta Curry Recipe,Spicy,Vegetarian
Chana Dal Chutney Recipe,Spicy,Vegetarian
Coriander Prawn Cakes Recipe,Spicy,Non-Vegetarian
Delicious Skillet Plum Cake Recipe,Spicy,Non-Vegetarian
Sweet Potato Dal Recipe,Spicy,Vegetarian
Beetroot Millet Paniyaram Recipe,Non-Spicy,Vegetarian
Nutty Oats Almond Truffle Recipe - A Healthy Snack,Non-Spicy,Vegetarian
Chicken and Mushroom Pot Pie Recipe,Spicy,Non-Vegetarian
Lentil Sauce Recipe - Stewed Coconut Milk Sauce,Spicy,Vegetarian
Tandoori Aloo Gobi Kathi Roll Recipe - Spicy Aloo Gobi Frankie,Spicy,Vegetarian
Roasted Potatoes & Zucchini Bake Recipe In A Creamy Parsley Sauce,Spicy,Vegetarian
Spiced Whole Wheat Carrot Cake Recipe,Non-Spicy,Non-Vegetarian
Grilled Tangy Lime Salmon Steak Recipe,Spicy,Non-Vegetarian
Bihari Shakarkand Bhujia Recipe - Spicy Sweet Potato Sabzi,Spicy,Vegetarian
Egg White Spinach Omelette Recipe With Garlic & Oregano,Spicy,Non-Vegetarian
No Onion No Garlic Spiced Apple Tomato Curry Recipe,Spicy,Vegetarian
Homemade Spicy Ramen with Tofu Recipe,Spicy,Vegetarian
Ambul Polos Curry - Sri Lankan Jack Fruit Curry Recipe With Pol Sambol,Spicy,Vegetarian
Stuffed Gilka Recipe (Maharashtrian Style Stuffed Silk Squash),Spicy,Vegetarian
Drumstick Spinach Juice Recipe,Spicy,Vegetarian
Palak Paneer Recipe - Palak Paneer Recipe,Spicy,Vegetarian
Broken Wheat Upma Or Dalia Khichdi Recipe for Babies & Toddlers,Non-Spicy,Vegetarian
Name Cucumber Salad Recipe - Quickcomber sausage,Spicy,Vegetarian
Crispy Vegetable Recipe - Crispy Bhujia,Spicy,Vegetarian
Dried Neem Flower Flavored Rice (Recipe in Hindi),Spicy,Vegetarian
Cauliflower Croquettes Recipe,Spicy,Non-Vegetarian
Broccoli And Aloo Poriyal Recipe - South Indian Broccoli And Potato Stir Fry,Spicy,Vegetarian
Hot and Spicy Chicken Curry Noodles Recipe,Spicy,Non-Vegetarian
Nendra Pazham Pulissery Recipe - Ayurvedic Recipe,Spicy,Vegetarian
Spinach Coriander Dosa Recipe - Spinach and Coriander Dosa Recipe,Spicy,Vegetarian
Rosemary And Thyme Chicken Recipe,Spicy,Non-Vegetarian
Akoori with Green Peas Recipe (Parsi Style Scrambled Eggs with Green Peas),Spicy,Non-Vegetarian
Mishti Doi Recipe - Traditional Bengali Sweet Yogurt,Non-Spicy,Vegetarian
