TranslatedRecipeName,Spice Tolerance,Dietary Preference
Pineapple And Semolina Sheera Recipe,Non-Spicy,Vegetarian
Chicken Meatballs In A Makhni Gravy Recipe,Spicy,Non-Vegetarian
Avarekalu Kadubu Recipe (Hyacinth Beans Steamed Dumplings),Spicy,Vegetarian
Chocolate Peda Recipe,Non-Spicy,Vegetarian
Zucchini Salad with Barbecue Sauce Dressing Recipe,Spicy,Vegetarian
Barnyard Millet Sweet Pongal Recipe (Kuthiraivali Sakkarai Pongal),Non-Spicy,Vegetarian
Lebanese Style Baked Chicken and Potatoes Recipe,Spicy,Non-Vegetarian
Kara Sevai Recipe (Lemon Vermicelli),Spicy,Vegetarian
"Summer Lettuce Salad with Cucumber, Tomato & Feta Recipe",Spicy,Vegetarian
Methi Thalipeeth Recipe (Fresh Fenugreek Leaves Flat Bread),Spicy,Vegetarian
Nepalese Chicken Sekuwa Recipe,Spicy,Non-Vegetarian
Khatua Recipe (Bhojpuri Style Khichdi),Spicy,Vegetarian
Tomato Onita d Kara,Spicy,Vegetarian
Saffron Milk Masala Recipe,Non-Spicy,Vegetarian
Chettinad Style Urulai Roast Recipe - Baby Potato Roast,Spicy,Vegetarian
Jackfruit Seed Korma Recipe,Spicy,Vegetarian
Chaat Masala Recipe,Spicy,Vegetarian
Whole Wheat Carrot Cake Recipe,Non-Spicy,Non-Vegetarian
Kodava Thalia Puttu Recipe - Steamed Rice Coconut Cake,Non-Spicy,Vegetarian
Cheesy Spinach Open Toast Recipe,Spicy,Vegetarian
Cabbage Bhurji Recipe,Spicy,Non-Vegetarian
Penne Rigate With Minced Chicken Sauce & Cheese Recipe,Spicy,Non-Vegetarian
Savory Ricotta Tart Recipe,Spicy,Non-Vegetarian
Keerai Masiyal Recipe (Stir Fried Green with Mustard and Curry Leaves),Non-Spicy,Vegetarian
Quick Cauliflower Fried Rice Recipe,Spicy,Vegetarian
Thai Grilled Pineapple Recipe,Non-Spicy,Vegetarian
Paneer Stuffed Bread Fritters Recipe,Spicy,Vegetarian
Cauliflower Thai Red Curry Recipe,Non-Spicy,Vegetarian
Gulab Jamun Bread Pudding Recipe,Non-Spicy,Non-Vegetarian
Potoler Dolma Recipe (Bengali Style Stuffed Pointed Gourd Curry),Spicy,Vegetarian
Sukhi Urad Dal Sabzi Recipe,Spicy,Vegetarian
Chicken Kappa Biryani Recipe,Spicy,Non-Vegetarian
Burnt Garlic Veg Fried Rice Recipe,Spicy,Vegetarian
Harive Soppina Saaru Recipe (Karnataka Style Amaranth Leaves Cooked with Lentils),Spicy,Vegetarian
Nutty Pineapple Tutti Frutti Cake Recipe (White Fruitcake),Spicy,Non-Vegetarian
Spicy Stir Fried Broccoli Recipe,Spicy,Vegetarian
Onion-Tomato Dosa Savoury Waffles Recipe,Spicy,Vegetarian
Savoury Kordoi Recipe (Assamese Star Fruit Shaped Snack Recipe),Spicy,Vegetarian
Sabsige Millet Pulav Recipe,Spicy,Vegetarian
Sweet And Tangy Mango Ice-cream Recipe,Spicy,Vegetarian
Safed Murgh Handi Recipe - Chicken In White Gravy,Spicy,Non-Vegetarian
Kanda Kairichi Chutney Recipe - Onion & Raw Mango Chutney,Spicy,Vegetarian
Protein Rich Paneer And Horse Gram Soup Recipe - Kollu/ Kulith Soup,Spicy,Vegetarian
Goan Style Podollim Recheado Com Batata Recipe (Snake Gourd Stuffed with Sweet Potato),Spicy,Vegetarian
Punjabi Style Tinda Sabzi Recipe,Spicy,Vegetarian
Sprouted Moong and Methi Cheela Recipe - A Healthy Breakfast,Spicy,Vegetarian
Veggie Chop Burger Recipe,Spicy,Vegetarian
Lemon Parsley Quinoa Recipe,Spicy,Vegetarian
Pumpkin Hummus Recipe,Spicy,Vegetarian
Homemade Dhansak Masala Powder Recipe,Spicy,Vegetarian
Quick And Simple Egg Curry Recipe,Spicy,Non-Vegetarian
Eggless Bread Omelette Recipe,Spicy,Vegetarian
Barnyard Millet and Ragi Khichdi Recipe,Spicy,Vegetarian
Coffee Recipe With Instant Coffee Powder,Spicy,Vegetarian
Manipuri Style Tan Ngang Recipe - Refined Flour/Maida Indian Puri Recipe,Spicy,Vegetarian
Mini Onion Vada With Vengaya Sambar Recipe - Pan Fried Fritters in Tangy Lentil Curry,Spicy,Vegetarian
North Kanara Sweet And Sour Raw Mango Chutney Recipe,Spicy,Vegetarian
German Pancakes with Caramelised Apples Recipe,Spicy,Non-Vegetarian
Dhokla Sandwich With Capsicum And Paneer Recipe,Spicy,Vegetarian
Phool Makhana Kheer Recipe - Sweetened With Jaggery,Non-Spicy,Vegetarian
Healthy Kala Chana Pakora Recipe - Black Chickpea Pakora,Spicy,Vegetarian
Malnad Special Appe Midi Uppinakayi Recipe - Tender Mango Pickle,Spicy,Vegetarian
Carrot Podi Dosa Recipe,Non-Spicy,Vegetarian
Cabbage Chana Dal Sabzi - Gobi Chana Dal Recipe,Spicy,Vegetarian
Tallyanche Suke Recipe - Sardine Dry,Spicy,Non-Vegetarian
South Indian Poli Recipe with Coconut (Obbattu/Bobbattu),Spicy,Vegetarian
Spicy Moroccan Rice With Chicken Recipe,Spicy,Non-Vegetarian
Moong khichdi recipe,Spicy,Vegetarian
Pineapple Banana & Oat Smoothie Recipe,Non-Spicy,Vegetarian
Eggless Orange and Apple Ice Cream Recipe,Non-Spicy,Vegetarian
Lauki Ke Gatte Recipe - Whole Wheat Bottle Gourd Dumplings,Spicy,Vegetarian
Paneer Jalfrezi Recipe,Spicy,Vegetarian
Bengali Phool Gobhir Paturi Recipe (Cauliflower & Potatoes With Poppy Seed Paste),Spicy,Vegetarian
Kongunadu Style Arisi Bedding Sudden Recipe,Spicy,Vegetarian
How To Make Homemade Rose Syrup Recipe,Non-Spicy,Vegetarian
Punjabi Garam Masala Powder Recipe,Spicy,Vegetarian
Moroccan Spiced Cauliflower And Almond Soup Recipe,Spicy,Vegetarian
Gutti Dondakaya Vepudu Recipe - Andhra Style Stuffed Ivy Gourds,Spicy,Vegetarian
"Cherry Tomato, Cucumber, Onion Salad in Red Wine Vinaigrette Dressing Recipe",Spicy,Vegetarian
Maharashtrian Style Kolhapuri Khichdi Recipe,Spicy,Vegetarian
Sandesh Panna Cotta Recipe,Non-Spicy,Vegetarian
Aloo Bhajit Recipe - Potato Bajji,Spicy,Vegetarian
Shakshuka With Spinach & Feta Cheese Recipe,Spicy,Non-Vegetarian
Spicy Minced Chicken Keema Balls Curry Recipe,Spicy,Non-Vegetarian
Dadpe Pohe Recipe (Maharashtrian Poha),Spicy,Vegetarian
Garlic Chicken Cheese Balls Recipe,Spicy,Non-Vegetarian
Kesar Paneer Ki Kheer Recipe - Cottage Cheese Milk Pudding,Non-Spicy,Vegetarian
Aubergine And Cranberry Beans Dip Recipe,Non-Spicy,Non-Vegetarian
Microwave Oats Milk Halwa Recipe,Non-Spicy,Non-Vegetarian
Cheesy Veg Paniyaram Recipe With Cheesy Tomato Chutney,Spicy,Vegetarian
Chicken Pies Recipe,Non-Spicy,Vegetarian
Spicy Indian Style Masala Frittata Recipe,Spicy,Non-Vegetarian
Melon Salsa Recipe,Spicy,Vegetarian
Giant Skillet Cookie Recipe,Non-Spicy,Non-Vegetarian
Lal Bhoplyacha Bharit Recipe (Red Pumpkin Raita),Spicy,Vegetarian
Gujarati Style Osaman Dal Recipe,Spicy,Vegetarian
Tomato Mozzarella Bites Recipe,Spicy,Vegetarian
Chettinad Pattani Kurma Recipe (Chettinad Peas Curry),Spicy,Vegetarian
Mustard Mayo Baby Potato Salad Recipe,Spicy,Non-Vegetarian
Low Pot Alo Ponda Recipe - Matte's Pit Paneer Pan,Spicy,Vegetarian
Hara Bhara Kebab Recipe with Millets,Spicy,Vegetarian
Easy Tomato And Cheese Mini Pizza Recipe,Spicy,Vegetarian
High Protein Broccoli & Coriander Loaf Recipe,Non-Spicy,Non-Vegetarian
Oats Pesarattu Recipe - Oatmeal & Green Gram Crepes,Spicy,Vegetarian
Maharashtrian Ambat Goda Dal Recipe,Spicy,Vegetarian
Boodida Gummadikaya Pachi Vadiyalu Recipe -Andhra Style Ash Gourd Fritters Recipe,Spicy,Vegetarian
Chettinad Chicken Curry Recipe - Chettinad Chicken Surri,Spicy,Non-Vegetarian
Karnataka Style Badanekayi Palya Recipe - Long Brinjal In Spicy Coconut Recipe,Spicy,Vegetarian
No Bake Fudge Brownies Recipe,Non-Spicy,Vegetarian
Udupi Style Pelakai Teepe Dose Recipe (Halasina Hanina Dose Recipe),Non-Spicy,Vegetarian
No Bake White Chocolate Cheesecake Recipe,Spicy,Vegetarian
Thai Basil Chicken Recipe-Pad Krapow Gai,Spicy,Non-Vegetarian
Snow Drop Cookies Recipe,Non-Spicy,Vegetarian
Roasted Cherry Tomato Soup Recipe,Spicy,Vegetarian
Kaju Pista Roll Recipe - Cashew Nut Pistachio Fudge,Non-Spicy,Vegetarian
Kathiawadi Dhokli Nu Shaak Recipe,Spicy,Vegetarian
Chocolate Chip Scone Recipe,Spicy,Non-Vegetarian
Eggless Date And Cashew Cake Recipe,Spicy,Vegetarian
Doodhibhoplyacha Bharit Recipe - Maharashtrian Style Lauki Bharta,Spicy,Vegetarian
Cabbage Carrot Onion Pudina Thepla Recipe,Spicy,Vegetarian
Cabbage Capsicum Sabzi Recipe - Simla Mirch Patta Gobi Sabzi,Spicy,Vegetarian
Spinach Ricotta Stuffed Ravioli Recipe Tossed In Cheesy Pumpkin Sauce,Spicy,Non-Vegetarian
Doodh Dudhi Recipe- Bottle Gourd In Milk Curry,Spicy,Vegetarian
Beetroot & Sesame Thepla Recipe,Spicy,Vegetarian
Capsicum Usili Recipe (Tamil Nadu Style Capsicum cooked with lentils spice mix),Spicy,Vegetarian
Kathirikai Sundakkai Vathal Kuzhambu Recipe,Spicy,Non-Vegetarian
Mutton Keema Recipe,Spicy,Non-Vegetarian
Kesar Elaichi Shrikand Recipe,Non-Spicy,Vegetarian
Dappalam Recipe- Andhra Vegetable Stew Recipe,Spicy,Vegetarian
Spinach Corn Pasta Recipe In Creamy White Sauce,Spicy,Vegetarian
Coriander Mint Chicken Tikka Recipe - Dhaniya Pudina Chicken Tikka Recipe,Spicy,Non-Vegetarian
Palak Tovve Recipe - Palak Tovve Recipe,Spicy,Vegetarian
Udupi Style Huli Podi Recipe (Sambar Powder),Spicy,Vegetarian
Cheesy Sweet Corn Grilled Sandwich Recipe,Spicy,Vegetarian
Yellow Pumpkin Pulao Recipe,Spicy,Vegetarian
Eggless Coffee Souffle Recipe With Chocolate Sauce,Spicy,Vegetarian
Oats and Green Moong Dal Dahi Vada Recipe,Spicy,Vegetarian
Rajasthani Hare Chana Halwa Recipe (Cholia Halwa),Non-Spicy,Vegetarian
Hyderabadi Marag Recipe,Spicy,Non-Vegetarian
Pan Fried Corn & Cheese Bites Recipe -Corn & Paneer Balls,Spicy,Vegetarian
Potato & Basil Frittata Recipe,Spicy,Non-Vegetarian
Churma Ladoo Recipe With Badam & Flaxseed - High Protein Snack,Spicy,Vegetarian
Suran Jo Kheemo Recipe-Sindhi Style Grated Yam Sabzi,Spicy,Vegetarian
Lentil Tabbouleh Recipe (Middle Eastern Vegetarian Salad With Lentils),Spicy,Vegetarian
Double Chocolate Coconut Fudge Recipe,Spicy,Vegetarian
Pepe Chingri Recipe - Green Papaya Prawn Curry Recipe,Spicy,Non-Vegetarian
Makai Dhokla Recipe - Savoury Steamed Corn Cake,Spicy,Vegetarian
Maharashtrian Dinkache Ladoo Recipe (Whole Wheat Flour Truffles With Edible Gum & Dry Fruits),Non-Spicy,Vegetarian
Wheat Paratha Recipe With Pizza Topping,Spicy,Vegetarian
Mysore Masala Dosa Made With Yeast Dosa Batter,Spicy,Vegetarian
Matar Chi Usal Recipe - Green Peas In A Onion Tomato Gravy,Spicy,Vegetarian
Omurice Recipe - Japanese Omelette Rice,Spicy,Non-Vegetarian
Sriracha Spiced Deviled Eggs Recipe,Spicy,Non-Vegetarian
Strawberry Bundt Cake with Muesli and Oats Recipe,Spicy,Non-Vegetarian
Beetroot Garlic Lemon Rasam Recipe,Spicy,Vegetarian
Cucumber / Cucumber Fry Recipe - Tindora Fry,Non-Spicy,Vegetarian
Egg Roast Masala Dosa Recipe - With Moong Dal Dosa Batter,Spicy,Non-Vegetarian
Spiced Chocolate And Beetroot Tea Cake Recipe,Spicy,Non-Vegetarian
Hariyali Chicken Tikka Wrap Recipe,Spicy,Non-Vegetarian
Brinjal Prawns Masala Curry Recipe - Baingan Prawn Masala,Spicy,Non-Vegetarian
Awadhi Style Taheri Recipe - Vegetable Rice Pulao Recipe,Spicy,Vegetarian
Oats and Rajma Cutlet Recipe,Spicy,Non-Vegetarian
Caramelised Onion Rosemary Chicken Recipe,Spicy,Non-Vegetarian
Chicken Keema Samosa Recipe,Spicy,Non-Vegetarian
Beetroot Cupcakes Recipe With Oreo Frosting,Non-Spicy,Non-Vegetarian
Buckwheat Vegetable Khichdi Recipe,Spicy,Vegetarian
Idly chat recipe,Spicy,Vegetarian
Bruschetta With Coriander Mint Pesto And Red Bell Peppers Recipe,Spicy,Vegetarian
Palak Kadhi Recipe - Spinach Kadhi,Spicy,Vegetarian
Restaurant Style Chicken 555 Recipe,Spicy,Non-Vegetarian
Kerala Tomato Fry Recipe - Kerala Tomato Fry Recipe,Spicy,Vegetarian
Dum Ke Shami Kebab Recipe,Spicy,Non-Vegetarian
Meat Masala Stuffed Bharwa Baingan Recipe,Non-Spicy,Non-Vegetarian
Steam Hilsa Recipe (SateAmed Hilsa),Spicy,Non-Vegetarian
Onion Pakora Roll Recipe,Spicy,Vegetarian
Banarasi Cabbage Vegetable Recipe - Chocolate Flower Cooked with Nigella,Spicy,Vegetarian
Makka Cholam Sundal Recipe (Spicy Sweet Corn Recipe),Spicy,Vegetarian
Mullangi Poriyal recipe - South Indian Style Radish Stir Fry,Spicy,Vegetarian
Anhui Bang Tofu Salad Recipe,Spicy,Vegetarian
Red Wine Chocolate Cake Recipe,Non-Spicy,Non-Vegetarian
Jaipuri Potato Onion Vegetable Recipe - Jaipuri Aloo Pyaz Ki Sabzi (Recipe In Hindi),Spicy,Vegetarian
Tagliatelle Pasta Recipe With Fresh Tomato Basil Sauce,Spicy,Vegetarian
One Pot Vegetable Biryani Recipe In Preethi Electric Pressure Cooker,Spicy,Vegetarian
Fada Ni Khichdi Recipe,Spicy,Vegetarian
Lavand-E-Murgh Recipe - Afghani Chicken In Yoghurt Gravy,Spicy,Non-Vegetarian
Raw Mango Dal Fry Recipe - Raw Mango Dal Fry Recipe,Spicy,Vegetarian
Mixed Vegetable Curry Roll Recipe,Spicy,Vegetarian
Cheese Crackers Recipe,Non-Spicy,Vegetarian
Mango Jalapeno Bruschetta Recipe,Spicy,Vegetarian
Kallu Knockout Recipe (Sprouted Horse Gram Wright Recipe),Spicy,Vegetarian
Homemade Pan Pizza With Perfectly Crispy Crust Recipe,Spicy,Vegetarian
Horsegram Sesame Chutney Recipe,Spicy,Vegetarian
Kerala Style Rich Creamy Egg Cashew Curry Recipe,Spicy,Non-Vegetarian
Egg Bhurji Stuffed Pita Pockets Recipe,Spicy,Non-Vegetarian
Yellow Cucumber Pachadi Recipe,Spicy,Vegetarian
Goan style Caril De Camarao Recipe (Prawn Curry Recipe),Spicy,Non-Vegetarian
Tamil Nadu Style Masala Dal Vada Recipe,Spicy,Vegetarian
Sticky Cranberry Gingerbread Recipe,Spicy,Non-Vegetarian
Paruppu Thogayal Recipe -Tour & Bengal Gram Chutney,Spicy,Vegetarian
Mushroom Do Pyaza Recipe,Spicy,Vegetarian
Buttermilk Cinnamon Rolls Recipe,Non-Spicy,Vegetarian
Pumpkin Spice Curry Recipe - Andhra Style Pumpkin Curry,Spicy,Vegetarian
Dark Chocolate Cream Jars Recipe,Non-Spicy,Non-Vegetarian
Spicy and Creamy Achari Mushroom Open Toast Recipe,Spicy,Vegetarian
Mango Greek Yogurt Cheesecake with Muesli Crumble Recipe,Spicy,Vegetarian
Mumbai Style Tawa Pulao Recipe With Moong Sprouts,Spicy,Vegetarian
Healthy Creamy Chicken Soup With Vegetables Recipe,Spicy,Non-Vegetarian
Gujarati Valsadi Vada Recipe - Multigran Masala Vada,Spicy,Vegetarian
Maharashtrian Tindora Sabzi With Peanuts Recipe,Spicy,Vegetarian
Goan Soya Mince Potato Chop Recipe,Spicy,Vegetarian
Chickpea Salad Recipe With Raw Mango,Spicy,Vegetarian
Kerala Style Beetroot Pachadi Recipe,Spicy,Vegetarian
Bitter gourd spice vegetable recipe,Spicy,Vegetarian
Foxtail Millet Podi Dosa Recipe,Non-Spicy,Vegetarian
Bhaja Pithe Recipe,Spicy,Vegetarian
Saag Tofu Recipe (Tofu Simmered in Spiced Mustard & Spinach Leaves),Spicy,Vegetarian
Vietnamese Lemongrass Shrimp Skewers Recipe,Spicy,Non-Vegetarian
Classic Indian Sliced Salad Recipe,Spicy,Vegetarian
Goan Kaju Curry Recipe (Spicy Goan Cashew Nut Curry),Spicy,Vegetarian
Summer Squash Pasta Recipe,Spicy,Vegetarian
Mexican Beans Salad Recipe,Spicy,Non-Vegetarian
Chettinad Paruppu Urundai Kuzhambu (Steamed Lentil Balls Cooked in a Tangy Curry) Recipe,Spicy,Vegetarian
Spinach And Corn Pasta Salad In Jar Recipe,Spicy,Vegetarian
Kaacha Gola Recipe (Bengali Sweet Cottage Cheese Balls),Non-Spicy,Vegetarian
Assamese Style Walking Catfish In Curry Leaf Gravy Recipe,Spicy,Non-Vegetarian
Khumb Kakuri Potli Kebab Recipe With Sandwich Spread,Spicy,Vegetarian
Bajra Khincha recipe,Spicy,Vegetarian
Potato Latkes Recipe,Spicy,Non-Vegetarian
Chettinad Vegetable Biryani Recipe,Spicy,Vegetarian
Asian Style Rice Noodle Salad Recipe With Vegetables Recipe,Spicy,Vegetarian
Banarasi Chuda Pea / Chuda Pea Recipe,Spicy,Vegetarian
Kashmiri Saag Recipe - Kashmiri Style Spinach / Palak,Spicy,Vegetarian
Kolhapuri Palak Egg Curry Recipe,Spicy,Non-Vegetarian
Keema Bhindi Masala Recipe - Okra & Minced Meat Curry,Spicy,Non-Vegetarian
Mushroom Empanadas Recipe,Spicy,Vegetarian
Uttarkhand Style Mixed Bhaddu Dal Recipe,Spicy,Non-Vegetarian
Cape Gooseberry Salad Recipe,Spicy,Vegetarian
Crisp Baked Tandoori Mayo Cheddar Chicken Recipe,Spicy,Non-Vegetarian
Amarod Curry Recipe (Parsi Steel Dry Guava Curry Recipe),Spicy,Vegetarian
Ratalu Pakora Recipe - Purple Yam Pakora/Fritters,Spicy,Vegetarian
Shahi Tindora Recipe - Tindora In Cashew Nut Gravy,Spicy,Vegetarian
Cinnamon Sugar Focaccia Bread Recipe,Non-Spicy,Vegetarian
Spinach And Corn Au Gratin Recipe With Cheesy Dip,Spicy,Vegetarian
Egg Rolls With Moringa Leaves Recipe-Eggs with Drumstick Leaves,Spicy,Non-Vegetarian
Brown Rice Flakes Pudding / Desi Poha Kheer Recipe,Non-Spicy,Vegetarian
Cardamom Macaroons Recipe,Spicy,Non-Vegetarian
Chilli Cheese Mushroom Momo Recipe,Spicy,Vegetarian
Goan Style Bimblanche Sasav Recipe,Spicy,Vegetarian
Chettinad Eral Thokku Recipe - Prawn Masala,Spicy,Non-Vegetarian
Kadai Chole Recipe- Dry Chickpeas Masala with Capsicum,Spicy,Vegetarian
Minced Meat & Corn Stuffed Bell Peppers Recipe,Spicy,Non-Vegetarian
Greek Style Vegan Moussaka Recipe,Spicy,Non-Vegetarian
Delicious Italian Chicken Cacciatore Recipe with Mushrooms & Olives - (Poultry & Vegetable Hunter's Stew),Spicy,Non-Vegetarian
Vegetable Manchow Soup Recipe,Spicy,Vegetarian
Himachali Style Pahari Aloo Palda Recipe - Potatoes In Yogurt Gravy,Spicy,Vegetarian
Chocolate Marble Cake Recipe Using Preethi Electric Pressure Cooker,Spicy,Non-Vegetarian
Nungu Payasam Recipe - Ice Apple/ Tender Palm Fruit Payasam,Non-Spicy,Vegetarian
Mangalorean Style Cheenikayi Kadubu Recipe (Pumpkin sweet idli Recipe),Non-Spicy,Vegetarian
Aval Upma Recipe - South Indian Style Poha,Spicy,Vegetarian
Shahjahani Khichdi Recipe - Spiked Green Moong Dal Khichdi,Spicy,Vegetarian
Aloo Bhindi Recipe Flavored With Mustard And Poppy Seeds,Spicy,Vegetarian
Iranian Tea Recipe,Spicy,Vegetarian
Drumstick Leaves Ragi Roti Recipe - Moringa Millet Flat Bread,Spicy,Vegetarian
Hariyali Matar Recipe,Spicy,Vegetarian
Rasawala Dhokla Recipe,Spicy,Vegetarian
Oats Methi Muthia Recipe-Healthy Diabetic Friendly Muthia,Spicy,Vegetarian
Keerai Vadai Recipe Made With Figaro Pure Olive Oil,Spicy,Vegetarian
Chicken Chops Recipe,Spicy,Non-Vegetarian
Caramelized Banana French Toast Recipe,Non-Spicy,Non-Vegetarian
Spicy Hot Chocolate Recipe - Perfect Drink For A Rainy Day or Winters,Spicy,Vegetarian
Aam Peda Recipe - Delicious Mango Peda Recipe,Spicy,Vegetarian
Tamil Nadu Style Milagu Thattai Recipe (Peppered Dal-Rice Fritters),Spicy,Vegetarian
Vanilla Panna Cotta Recipe with Cocoa & Mint,Non-Spicy,Vegetarian
Doi Shorshe Chingri - Prawn Mustard Curry Recipe,Spicy,Non-Vegetarian
Paneer and Green Peas Paratha Recipe,Spicy,Vegetarian
Radish and Wadi vegetable recipe,Spicy,Vegetarian
Moong Dal Dosa Recipe,Spicy,Vegetarian
Bengali Style Chicken Rezala Recipe - Chicken Korma Recipe,Spicy,Non-Vegetarian
Afghani Dhoog Recipe - Cucumber Mint Buttermilk/ Chaas,Non-Spicy,Vegetarian
Bhoplya Cha Bharit Recipe � Maharashtrian Pumpkin Sabzi,Spicy,Vegetarian
Mixed Vegetable Pulao Recipe,Spicy,Vegetarian
Bow Tie Pasta With Baby Spinach Recipe,Spicy,Vegetarian
Cheesy Stuffed Schezwan Pav Recipe,Spicy,Vegetarian
Mushroom Baby Corn Kaalimirri Recipe - Pepper Cashew Gravy,Spicy,Vegetarian
Fluffy & Crispy Cheese Herbed Biscuits Recipe,Spicy,Vegetarian
Bhopli Mirchi Chi Peeth Perun Bhaji Recipe,Spicy,Vegetarian
No Onion No Garlic Cabbage Kofta Curry Recipe,Spicy,Vegetarian
Karuveppilai Kuzhambu Recipe (Tangy & Spicy Curry Leaves Curry),Spicy,Vegetarian
No Bake Marie Biscuit Energy Bites Recipe,Non-Spicy,Vegetarian
Goan Style Mushroom Vindaloo Recipe,Spicy,Vegetarian
Eggless Coffee Caramel Cake With Walnuts Recipe,Spicy,Vegetarian
Saunf Wale Aloo Baingan Recipe - Fennel Spiced Potato And Eggplant,Spicy,Non-Vegetarian
Oatmeal Cherry Cookies Recipe,Non-Spicy,Vegetarian
Oatmeal Banana Mini Muffins Recipe,Non-Spicy,Non-Vegetarian
Chocolate Lover's Cheesecake Recipe,Non-Spicy,Vegetarian
Potato Vegetable Recipe - Lu Tomato Key Vegetable,Spicy,Vegetarian
Red Wine Sauce Over Baked Sole Fish Recipe,Spicy,Non-Vegetarian
Lemongrass Flavored Tofu Fried Rice Recipe,Spicy,Vegetarian
Bhel Puri With Raw Mango Recipe,Spicy,Vegetarian
Broccoli Pakora Masala Recipe - Broccoli In Spicy Yogurt Gravy,Spicy,Vegetarian
Long Brinjal Poriyal Masala Recipe - Green Baingan Sabzi,Spicy,Vegetarian
Menthi Vankaya Recipe - Andhra Style Fenugreek Spiced Baingan,Spicy,Non-Vegetarian
Baale Dindu Kadale Palya - Banana Stem Curry With Chickpeas Recipe,Spicy,Vegetarian
Gujarati Lasaniya Batata Recipe - Garlic Potato Curry,Spicy,Vegetarian
Healthy Lauki Kofta Curry Recipe | Non Fried Bottle Gourd Coffee Curry | Dhoodi Kofta,Spicy,Vegetarian
Corn and Peas Curry Recipe - Corn And Peas Curry Recipe,Spicy,Vegetarian
Tomato Basil Chicken Curry Recipe,Spicy,Non-Vegetarian
Kerala Style Eggplant Curry Recipe - Kerala Style Eggplant Curry,Spicy,Vegetarian
Grilled Chicken Wings Recipe,Spicy,Non-Vegetarian
Veechu Parotta Or Ceylon Parotta Recipe,Non-Spicy,Vegetarian
Mawa Gujiya With Badam and Pista Recipe,Non-Spicy,Non-Vegetarian
Chettinad Rasam Powder Recipe,Spicy,Vegetarian
Paneer Stuffed Bhindi In Ajwain Tomato Gravy Recipe,Spicy,Vegetarian
Asian Style Stuffed Omelette Recipe,Spicy,Non-Vegetarian
Aluchi Bhaji Recipe - Maharashtrian Style Colocasia Leaves Curry,Spicy,Vegetarian
Amritsari Fish Fry Recipe,Spicy,Non-Vegetarian
Chickpea Sundal Recipe,Spicy,Vegetarian
Thai Coconut Curry Soup Recipe,Spicy,Vegetarian
Inji Thogayal Recipe - Spicy & Delicious Ginger Chutney,Spicy,Vegetarian
Diwali Cornflakes Mixture Recipe - A Savory Evening Tea Snack,Spicy,Vegetarian
Kaju Pakoda Recipe (Cashew Nut Fritters),Spicy,Vegetarian
South Indian Grilled Fish With Spicy Fusion Sauce Recipe,Spicy,Non-Vegetarian
Methi Moong Dal Palak Recipe,Spicy,Vegetarian
Sindhi Style Chicken Curry Recipe Using Preethi Electric Pressure Cooker,Spicy,Non-Vegetarian
Indian Style Jeera Biscuit Recipe,Spicy,Vegetarian
Pudina Moong Dal Recipe (Mint Moong Dal),Spicy,Vegetarian
Shrimp Spinach Cheese Swirl Recipe,Spicy,Non-Vegetarian
Matar Poha Recipe (Flattened Rice Stir Fry with Green Peas),Spicy,Vegetarian
Udupi Style Thondekayi And Badnekayi Sambar Recipe - Ivy Gourd & Brinjal Sambar,Spicy,Non-Vegetarian
Kumaon Style Thechwani Recipe-Mooli Aloo Sabzi,Spicy,Vegetarian
Chicken Ranch Wraps Recipe,Spicy,Non-Vegetarian
Arbi Ka Achaar Recipe (Instant Colocasia pickle),Spicy,Vegetarian
Olive & Tofu In Harissa Curry Recipe,Spicy,Vegetarian
Chiroti Recipe - Delicious Crispy Layered Sweet Puri,Spicy,Vegetarian
Paneer Malai Makhani Biryani Recipe,Spicy,Vegetarian
Raw Mango Carrot Cucumber Salad Recipe With Peanuts,Spicy,Vegetarian
Dried Cranberry & White Chocolate Chip Biscotti Recipe,Non-Spicy,Non-Vegetarian
Andhra Style Sorakaya Kura Recipe - Bottle Gourd And Toor Dal Recipe,Spicy,Vegetarian
Delhi Style Matar Chaat Recipe - Spicy & Tangy Green Peas Chaat,Spicy,Vegetarian
Kongunadu Style Senai Kilangu Masala Recipe - Yam in Spicy Gravy,Spicy,Vegetarian
No Onion No Garlic Aloo Gajar Ki Sabzi Recipe,Spicy,Vegetarian
Konkani Style Karate Batate Puddi Sagle Recipe - Bitter Gourd & Potato Curry,Spicy,Vegetarian
Olya Kaju Chi Amti Recipe - Malvani Cashew Nut Curry,Spicy,Vegetarian
Chettinad Mint Potato Biryani Recipe,Spicy,Vegetarian
Puffed Lotus Seed Pakoras Recipe - Makhana Pakora,Spicy,Vegetarian
Thengai Paal Kurma Recipe - Mixed Vegetables In Coconut Gravy,Spicy,Vegetarian
Kala Chana Pilaf Recipe,Spicy,Vegetarian
Drumstick Leaves Fried Rice Recipe,Spicy,Vegetarian
Fish Fry Recipe - Kerala Style Fish Split,Spicy,Non-Vegetarian
Meetha Daliya With Milk & Fruits Recipe - Broken Wheat Porridge,Spicy,Vegetarian
Whole Wheat Naan Recipe,Non-Spicy,Vegetarian
Amritsari Murgh Makhani Recipe- Chicken Makhani Recipe,Spicy,Non-Vegetarian
Semolina Vegetable Chilla Recipe,Spicy,Vegetarian
How To Make Homemade Kashmiri Masala/ Spice Mix Recipe,Spicy,Vegetarian
Pumpkin Coconut Ladoo Recipe,Non-Spicy,Vegetarian
Raw Banana Tikkis Recipe,Spicy,Vegetarian
Katachi Amti Recipe (Spicy Accompaniment To Maharashtrian Puran Poli),Spicy,Vegetarian
Maharashtrian Vegetable Amboli Recipe (Savory Lentil Pancake Topped With Vegetables),Spicy,Vegetarian
 Amrood Raita Recipe,Spicy,Vegetarian
Goan Style Kulkuls Recipe (Honey glazed wheat Curls Recipe),Non-Spicy,Non-Vegetarian
Pumpkin Cheesecake Recipe,Spicy,Non-Vegetarian
Tofu Fried Rice Recipe,Spicy,Vegetarian
Stuffed Strawberries Recipe With Grated Paneer,Non-Spicy,Vegetarian
Mango Phirni Recipe - Mango Rice Pudding Recipe,Non-Spicy,Vegetarian
Spicy Mushroom Veggie Burger Recipe,Spicy,Vegetarian
Healthy Amaranth Potato Thyme Croquette Recipe,Spicy,Vegetarian
Herbed Buttered Rice Recipe With Green Peas,Spicy,Vegetarian
Stuffed Kathal Recipe,Spicy,Vegetarian
Gujarati Meetha Pudla Recipe With Caramelized Bananas,Non-Spicy,Vegetarian
Stuffed Idli Ke Pakode Recipe,Spicy,Vegetarian
Rajgira Puri Recipe (Navratri Fasting/Vrat Recipe),Spicy,Vegetarian
Spiced Rajma Pulao Recipe - Spiced Kidney Bean Rice,Spicy,Non-Vegetarian
Kashmiri Style Apple Tamatar Sabzi Recipe - No Onion No Garlic,Spicy,Vegetarian
Eggless Marble Cake Recipe,Non-Spicy,Vegetarian
Gulkand Kala Jamun Recipe,Spicy,Vegetarian
Mutton Ghee Roast Recipe,Spicy,Non-Vegetarian
Karnataka Style Churumuri Recipe-Spicy Puffed Rice Recipe,Spicy,Vegetarian
Eggless Whole Wheat Tutti Frutti Cake Recipe,Spicy,Vegetarian
Hare Chane Ka Pulav Recipe,Spicy,Vegetarian
Carrot Ribbon Salad With Asian Sesame Dressing Recipe,Spicy,Vegetarian
Maharashtrian Achar Ka Masala (Pickle Mix Recipe),Spicy,Vegetarian
Thai Style Curried Corn Fritters Recipe,Spicy,Non-Vegetarian
Strawberry Cheesecake Muffins Recipe,Non-Spicy,Non-Vegetarian
Perfect Gooey Mozzarella Garlic Bread Recipe,Spicy,Vegetarian
Bengali Style Dhokar Dalna Recipe (Spiced Lentil Cakes in Tomato Gravy Recipe),Spicy,Vegetarian
Gan Bian Dou Jiao Recipe (Dry Fried Sichuan Haricot Beans),Spicy,Vegetarian
 Karnataka Style Sorakkai Palya (Recipe In Hindi),Spicy,Vegetarian
Dahi Suran Ki Kadhi Recipe - Yam Cooked In Yogurt Curry,Spicy,Vegetarian
 Raw Mango And Spring Onion Chutney Recipe,Spicy,Vegetarian
 Punjabi Style Egg Curry Recipe,Spicy,Non-Vegetarian
Mango Shrikhand Taco Recipe - Sweet Mango Yogurt Dip Taco,Spicy,Vegetarian
Black Eyed Bean Lemon Bruschetta Recipe,Spicy,Vegetarian
Pav Bhaji Pizza Recipe,Spicy,Vegetarian
Fenugreek & Egg Fried Rice Recipe (Anda Methi Chawal),Spicy,Non-Vegetarian
Cheesy Tawa Pizza Recipe With Corn And Broccoli,Spicy,Vegetarian
Cabbage Poricha Kootu Recipe (Red Cabbage) - South Indian Cabbage Dal,Spicy,Vegetarian
Pyaaz Ki Kachori Recipe,Spicy,Vegetarian
Mexican Cottage Cheese Chicken Enchilada Recipe,Spicy,Non-Vegetarian
Mango Tofu Smoothie Recipe,Non-Spicy,Vegetarian
 Carrot Soup Recipe,Spicy,Vegetarian
Keerai Karamani Kuzhambu- Palak Lobia Curry Recipe,Spicy,Vegetarian
Onion Rava Bhakri Recipe (Goan Kanyachi Bhakri),Spicy,Vegetarian
 Chatpatti Makai Masala Recipe,Spicy,Vegetarian
Bedmi Poori Recipe - Spiced Split Black Lentil Pooris,Spicy,Vegetarian
Instant Cucumber Pickle Recipe,Spicy,Vegetarian
